2907 IP lamp-ubuntu-s-1vcpu-1gb-tor1-01.ssh > cpec09435c3be97-cmc09435c3be95.cpe.net.cable.rogers.com.58902: Flags [P.], seq 2353580:2353800, ack 1261, win 501, length 220
09:49:18.743014 IP lamp-ubuntu-s-1vcpu-1gb-tor1-01.ssh > cpec09435c3be97-cmc09435c3be95.cpe.net.cable.rogers.com.58902: Flags [P.], seq 2353800:2354020, ack 1261, win 501, length 220
09:49:18.743102 IP lamp-ubuntu-s-1vcpu-1gb-tor1-01.ssh > cpec09435c3be97-cmc09435c3be95.cpe.net.cable.rogers.com.58902: Flags [P.], seq 2354020:2354240, ack 1261, win 501, length 220
09:49:18.743166 IP lamp-ubuntu-s-1vcpu-1gb-tor1-01.ssh > cpec09435c3be97-cmc09435c3be95.cpe.net.cable.rogers.com.58902: Flags [P.], seq 2354240:2354460, ack 1261, win 501, length 220
09:49:18.743222 IP lamp-ubuntu-s-1vcpu-1gb-tor1-01.ssh > cpec09435c3be97-cmc09435c3be95.cpe.net.cable.rogers.com.58902: Flags [P.], seq 2354460:2354680, ack 1261, win 501, length 220
09:49:18.743276 IP lamp-ubuntu-s-1vcpu-1gb-tor1-01.ssh > cpec09435c3be97-cmc09435c3be95.cpe.net.cable.rogers.com.58902: Flags [P.], seq 2354680:2354900, ack 1261, win 501, length 220
09:49:18.743340 IP lamp-ubuntu-s-1vcpu-1gb-tor1-01.ssh > cpec09435c3be97-cmc09435c3be95.cpe.net.cable.rogers.com.58902: Flags [P.], seq 2354900:2355120, ack 1261, win 501, length 220
09:49:18.743396 IP lamp-ubuntu-s-1vcpu-1gb-tor1-01.ssh > cpec09435c3be97-cmc09435c3be95.cpe.net.cable.rogers.com.58902: Flags [P.], seq 2355120:2355340, ack 1261, win 501, length 220
09:49:18.743451 IP lamp-ubuntu-s-1vcpu-1gb-tor1-01.ssh > cpec09435c3be97-cmc09435c3be95.cpe.net.cable.rogers.com.58902: Flags [P.], seq 2355340:2355560, ack 1261, win 501, length 220
09:49:18.743508 IP lamp-ubuntu-s-1vcpu-1gb-tor1-01.ssh > cpec09435c3be97-cmc09435c3be95.cpe.net.cable.rogers.com.58902: Flags [P.], seq 2355560:2355780, ack 1261, win 501, length 220
09:49:18.743562 IP lamp-ubuntu-s-1vcpu-1gb-tor1-01.ssh > cpec09435c3be97-cmc09435c3be95.cpe.net.cable.rogers.com.58902: Flags [P.], seq 2355780:2356000, ack 1261, win 501, length 220
09:49:18.743615 IP lamp-ubuntu-s-1vcpu-1gb-tor1-01.ssh > cpec09435c3be97-cmc09435c3be95.cpe.net.cable.rogers.com.58902: Flags [P.], seq 2356000:2356220, ack 1261, win 501, length 220
09:49:18.743693 IP lamp-ubuntu-s-1vcpu-1gb-tor1-01.ssh > cpec09435c3be97-cmc09435c3be95.cpe.net.cable.rogers.com.58902: Flags [P.], seq 2356220:2356440, ack 1261, win 501, length 220
09:49:18.743784 IP lamp-ubuntu-s-1vcpu-1gb-tor1-01.ssh > cpec09435c3be97-cmc09435c3be95.cpe.net.cable.rogers.com.58902: Flags [P.], seq 2356440:2356660, ack 1261, win 501, length 220
09:49:18.743857 IP lamp-ubuntu-s-1vcpu-1gb-tor1-01.ssh > cpec09435c3be97-cmc09435c3be95.cpe.net.cable.rogers.com.58902: Flags [P.], seq 2356660:2356880, ack 1261, win 501, length 220
09:49:18.743941 IP lamp-ubuntu-s-1vcpu-1gb-tor1-01.ssh > cpec09435c3be97-cmc09435c3be95.cpe.net.cable.rogers.com.58902: Flags [P.], seq 2356880:2357100, ack 1261, win 501, length 220
09:49:18.744037 IP lamp-ubuntu-s-1vcpu-1gb-tor1-01.ssh > cpec09435c3be97-cmc09435c3be95.cpe.net.cable.rogers.com.58902: Flags [P.], seq 2357100:2357320, ack 1261, win 501, length 220
09:49:18.744094 IP lamp-ubuntu-s-1vcpu-1gb-tor1-01.ssh > cpec09435c3be97-cmc09435c3be95.cpe.net.cable.rogers.com.58902: Flags [P.], seq 2357320:2357540, ack 1261, win 501, length 220
09:49:18.744173 IP lamp-ubuntu-s-1vcpu-1gb-tor1-01.ssh > cpec09435c3be97-cmc09435c3be95.cpe.net.cable.rogers.com.58902: Flags [P.], seq 2357540:2357760, ack 1261, win 501, length 220
09:49:18.744273 IP lamp-ubuntu-s-1vcpu-1gb-tor1-01.ssh > cpec09435c3be97-cmc09435c3be95.cpe.net.cable.rogers.com.58902: Flags [P.], seq 2357760:2357980, ack 1261, win 501, length 220
09:49:18.744365 IP lamp-ubuntu-s-1vcpu-1gb-tor1-01.ssh > cpec09435c3be97-cmc09435c3be95.cpe.net.cable.rogers.com.58902: Flags [P.], seq 2357980:2358200, ack 1261, win 501, length 220
09:49:18.744452 IP lamp-ubuntu-s-1vcpu-1gb-tor1-01.ssh > cpec09435c3be97-cmc09435c3be95.cpe.net.cable.rogers.com.58902: Flags [P.], seq 2358200:2358420, ack 1261, win 501, length 220
09:49:18.744548 IP lamp-ubuntu-s-1vcpu-1gb-tor1-01.ssh > cpec09435c3be97-cmc09435c3be95.cpe.net.cable.rogers.com.58902: Flags [P.], seq 2358420:2358640, ack 1261, win 501, length 220
09:49:18.744632 IP lamp-ubuntu-s-1vcpu-1gb-tor1-01.ssh > cpec09435c3be97-cmc09435c3be95.cpe.net.cable.rogers.com.58902: Flags [P.], seq 2358640:2358860, ack 1261, win 501, length 220
09:49:18.744708 IP lamp-ubuntu-s-1vcpu-1gb-tor1-01.ssh > cpec09435c3be97-cmc09435c3be95.cpe.net.cable.rogers.com.58902: Flags [P.], seq 2358860:2359080, ack 1261, win 501, length 220
09:49:18.744777 IP lamp-ubuntu-s-1vcpu-1gb-tor1-01.ssh > cpec09435c3be97-cmc09435c3be95.cpe.net.cable.rogers.com.58902: Flags [P.], seq 2359080:2359300, ack 1261, win 501, length 220
09:49:18.744836 IP lamp-ubuntu-s-1vcpu-1gb-tor1-01.ssh > cpec09435c3be97-cmc09435c3be95.cpe.net.cable.rogers.com.58902: Flags [P.], seq 2359300:2359520, ack 1261, win 501, length 220
09:49:18.744890 IP lamp-ubuntu-s-1vcpu-1gb-tor1-01.ssh > cpec09435c3be97-cmc09435c3be95.cpe.net.cable.rogers.com.58902: Flags [P.], seq 2359520:2359740, ack 1261, win 501, length 220
09:49:18.744945 IP lamp-ubuntu-s-1vcpu-1gb-tor1-01.ssh > cpec09435c3be97-cmc09435c3be95.cpe.net.cable.rogers.com.58902: Flags [P.], seq 2359740:2359960, ack 1261, win 501, length 220
09:49:18.745010 IP lamp-ubuntu-s-1vcpu-1gb-tor1-01.ssh > cpec09435c3be97-cmc09435c3be95.cpe.net.cable.rogers.com.58902: Flags [P.], seq 2359960:2360180, ack 1261, win 501, length 220
09:49:18.745093 IP lamp-ubuntu-s-1vcpu-1gb-tor1-01.ssh > cpec09435c3be97-cmc09435c3be95.cpe.net.cable.rogers.com.58902: Flags [P.], seq 2360180:2360400, ack 1261, win 501, length 220
09:49:18.745176 IP lamp-ubuntu-s-1vcpu-1gb-tor1-01.ssh > cpec09435c3be97-cmc09435c3be95.cpe.net.cable.rogers.com.58902: Flags [P.], seq 2360400:2360620, ack 1261, win 501, length 220
09:49:18.745262 IP lamp-ubuntu-s-1vcpu-1gb-tor1-01.ssh > cpec09435c3be97-cmc09435c3be95.cpe.net.cable.rogers.com.58902: Flags [P.], seq 2360620:2360840, ack 1261, win 501, length 220
09:49:18.745353 IP lamp-ubuntu-s-1vcpu-1gb-tor1-01.ssh > cpec09435c3be97-cmc09435c3be95.cpe.net.cable.rogers.com.58902: Flags [P.], seq 2360840:2361060, ack 1261, win 501, length 220
09:49:18.745441 IP lamp-ubuntu-s-1vcpu-1gb-tor1-01.ssh > cpec09435c3be97-cmc09435c3be95.cpe.net.cable.rogers.com.58902: Flags [P.], seq 2361060:2361280, ack 1261, win 501, length 220
09:49:18.745518 IP lamp-ubuntu-s-1vcpu-1gb-tor1-01.ssh > cpec09435c3be97-cmc09435c3be95.cpe.net.cable.rogers.com.58902: Flags [P.], seq 2361280:2361500, ack 1261, win 501, length 220
09:49:18.745583 IP lamp-ubuntu-s-1vcpu-1gb-tor1-01.ssh > cpec09435c3be97-cmc09435c3be95.cpe.net.cable.rogers.com.58902: Flags [P.], seq 2361500:2361720, ack 1261, win 501, length 220
09:49:18.745654 IP lamp-ubuntu-s-1vcpu-1gb-tor1-01.ssh > cpec09435c3be97-cmc09435c3be95.cpe.net.cable.rogers.com.58902: Flags [P.], seq 2361720:2361940, ack 1261, win 501, length 220
09:49:18.745713 IP lamp-ubuntu-s-1vcpu-1gb-tor1-01.ssh > cpec09435c3be97-cmc09435c3be95.cpe.net.cable.rogers.com.58902: Flags [P.], seq 2361940:2362160, ack 1261, win 501, length 220
09:49:18.745788 IP lamp-ubuntu-s-1vcpu-1gb-tor1-01.ssh > cpec09435c3be97-cmc09435c3be95.cpe.net.cable.rogers.com.58902: Flags [P.], seq 2362160:2362380, ack 1261, win 501, length 220
09:49:18.745843 IP lamp-ubuntu-s-1vcpu-1gb-tor1-01.ssh > cpec09435c3be97-cmc09435c3be95.cpe.net.cable.rogers.com.58902: Flags [P.], seq 2362380:2362600, ack 1261, win 501, length 220
09:49:18.745901 IP lamp-ubuntu-s-1vcpu-1gb-tor1-01.ssh > cpec09435c3be97-cmc09435c3be95.cpe.net.cable.rogers.com.58902: Flags [P.], seq 2362600:2362820, ack 1261, win 501, length 220
09:49:18.745955 IP lamp-ubuntu-s-1vcpu-1gb-tor1-01.ssh > cpec09435c3be97-cmc09435c3be95.cpe.net.cable.rogers.com.58902: Flags [P.], seq 2362820:2363040, ack 1261, win 501, length 220
09:49:18.746014 IP lamp-ubuntu-s-1vcpu-1gb-tor1-01.ssh > cpec09435c3be97-cmc09435c3be95.cpe.net.cable.rogers.com.58902: Flags [P.], seq 2363040:2363260, ack 1261, win 501, length 220
09:49:18.746068 IP lamp-ubuntu-s-1vcpu-1gb-tor1-01.ssh > cpec09435c3be97-cmc09435c3be95.cpe.net.cable.rogers.com.58902: Flags [P.], seq 2363260:2363480, ack 1261, win 501, length 220
09:49:18.746126 IP lamp-ubuntu-s-1vcpu-1gb-tor1-01.ssh > cpec09435c3be97-cmc09435c3be95.cpe.net.cable.rogers.com.58902: Flags [P.], seq 2363480:2363700, ack 1261, win 501, length 220
09:49:18.746178 IP lamp-ubuntu-s-1vcpu-1gb-tor1-01.ssh > cpec09435c3be97-cmc09435c3be95.cpe.net.cable.rogers.com.58902: Flags [P.], seq 2363700:2363920, ack 1261, win 501, length 220
09:49:18.746236 IP lamp-ubuntu-s-1vcpu-1gb-tor1-01.ssh > cpec09435c3be97-cmc09435c3be95.cpe.net.cable.rogers.com.58902: Flags [P.], seq 2363920:2364140, ack 1261, win 501, length 220
09:49:18.746293 IP lamp-ubuntu-s-1vcpu-1gb-tor1-01.ssh > cpec09435c3be97-cmc09435c3be95.cpe.net.cable.rogers.com.58902: Flags [P.], seq 2364140:2364360, ack 1261, win 501, length 220
09:49:18.746346 IP lamp-ubuntu-s-1vcpu-1gb-tor1-01.ssh > cpec09435c3be97-cmc09435c3be95.cpe.net.cable.rogers.com.58902: Flags [P.], seq 2364360:2364580, ack 1261, win 501, length 220
09:49:18.746404 IP lamp-ubuntu-s-1vcpu-1gb-tor1-01.ssh > cpec09435c3be97-cmc09435c3be95.cpe.net.cable.rogers.com.58902: Flags [P.], seq 2364580:2364800, ack 1261, win 501, length 220
09:49:18.746460 IP lamp-ubuntu-s-1vcpu-1gb-tor1-01.ssh > cpec09435c3be97-cmc09435c3be95.cpe.net.cable.rogers.com.58902: Flags [P.], seq 2364800:2365020, ack 1261, win 501, length 220
09:49:18.746516 IP lamp-ubuntu-s-1vcpu-1gb-tor1-01.ssh > cpec09435c3be97-cmc09435c3be95.cpe.net.cable.rogers.com.58902: Flags [P.], seq 2365020:2365240, ack 1261, win 501, length 220
09:49:18.746570 IP lamp-ubuntu-s-1vcpu-1gb-tor1-01.ssh > cpec09435c3be97-cmc09435c3be95.cpe.net.cable.rogers.com.58902: Flags [P.], seq 2365240:2365460, ack 1261, win 501, length 220
09:49:18.746628 IP lamp-ubuntu-s-1vcpu-1gb-tor1-01.ssh > cpec09435c3be97-cmc09435c3be95.cpe.net.cable.rogers.com.58902: Flags [P.], seq 2365460:2365680, ack 1261, win 501, length 220
09:49:18.746680 IP lamp-ubuntu-s-1vcpu-1gb-tor1-01.ssh > cpec09435c3be97-cmc09435c3be95.cpe.net.cable.rogers.com.58902: Flags [P.], seq 2365680:2365900, ack 1261, win 501, length 220
09:49:18.746753 IP lamp-ubuntu-s-1vcpu-1gb-tor1-01.ssh > cpec09435c3be97-cmc09435c3be95.cpe.net.cable.rogers.com.58902: Flags [P.], seq 2365900:2366120, ack 1261, win 501, length 220
09:49:18.746816 IP lamp-ubuntu-s-1vcpu-1gb-tor1-01.ssh > cpec09435c3be97-cmc09435c3be95.cpe.net.cable.rogers.com.58902: Flags [P.], seq 2366120:2366340, ack 1261, win 501, length 220
09:49:18.746891 IP lamp-ubuntu-s-1vcpu-1gb-tor1-01.ssh > cpec09435c3be97-cmc09435c3be95.cpe.net.cable.rogers.com.58902: Flags [P.], seq 2366340:2366560, ack 1261, win 501, length 220
09:49:18.746977 IP lamp-ubuntu-s-1vcpu-1gb-tor1-01.ssh > cpec09435c3be97-cmc09435c3be95.cpe.net.cable.rogers.com.58902: Flags [P.], seq 2366560:2366780, ack 1261, win 501, length 220
09:49:18.747036 IP lamp-ubuntu-s-1vcpu-1gb-tor1-01.ssh > cpec09435c3be97-cmc09435c3be95.cpe.net.cable.rogers.com.58902: Flags [P.], seq 2366780:2367000, ack 1261, win 501, length 220
09:49:18.747096 IP lamp-ubuntu-s-1vcpu-1gb-tor1-01.ssh > cpec09435c3be97-cmc09435c3be95.cpe.net.cable.rogers.com.58902: Flags [P.], seq 2367000:2367220, ack 1261, win 501, length 220
09:49:18.747150 IP lamp-ubuntu-s-1vcpu-1gb-tor1-01.ssh > cpec09435c3be97-cmc09435c3be95.cpe.net.cable.rogers.com.58902: Flags [P.], seq 2367220:2367440, ack 1261, win 501, length 220
09:49:18.747224 IP lamp-ubuntu-s-1vcpu-1gb-tor1-01.ssh > cpec09435c3be97-cmc09435c3be95.cpe.net.cable.rogers.com.58902: Flags [P.], seq 2367440:2367660, ack 1261, win 501, length 220
09:49:18.747286 IP lamp-ubuntu-s-1vcpu-1gb-tor1-01.ssh > cpec09435c3be97-cmc09435c3be95.cpe.net.cable.rogers.com.58902: Flags [P.], seq 2367660:2367880, ack 1261, win 501, length 220
09:49:18.747493 IP lamp-ubuntu-s-1vcpu-1gb-tor1-01.ssh > cpec09435c3be97-cmc09435c3be95.cpe.net.cable.rogers.com.58902: Flags [P.], seq 2367880:2368100, ack 1261, win 501, length 220
09:49:18.747560 IP lamp-ubuntu-s-1vcpu-1gb-tor1-01.ssh > cpec09435c3be97-cmc09435c3be95.cpe.net.cable.rogers.com.58902: Flags [P.], seq 2368100:2368320, ack 1261, win 501, length 220
09:49:18.747620 IP lamp-ubuntu-s-1vcpu-1gb-tor1-01.ssh > cpec09435c3be97-cmc09435c3be95.cpe.net.cable.rogers.com.58902: Flags [P.], seq 2368320:2368540, ack 1261, win 501, length 220
09:49:18.747703 IP lamp-ubuntu-s-1vcpu-1gb-tor1-01.ssh > cpec09435c3be97-cmc09435c3be95.cpe.net.cable.rogers.com.58902: Flags [P.], seq 2368540:2368760, ack 1261, win 501, length 220
09:49:18.747787 IP lamp-ubuntu-s-1vcpu-1gb-tor1-01.ssh > cpec09435c3be97-cmc09435c3be95.cpe.net.cable.rogers.com.58902: Flags [P.], seq 2368760:2368980, ack 1261, win 501, length 220
09:49:18.747853 IP lamp-ubuntu-s-1vcpu-1gb-tor1-01.ssh > cpec09435c3be97-cmc09435c3be95.cpe.net.cable.rogers.com.58902: Flags [P.], seq 2368980:2369200, ack 1261, win 501, length 220
09:49:18.747912 IP lamp-ubuntu-s-1vcpu-1gb-tor1-01.ssh > cpec09435c3be97-cmc09435c3be95.cpe.net.cable.rogers.com.58902: Flags [P.], seq 2369200:2369420, ack 1261, win 501, length 220
09:49:18.747968 IP lamp-ubuntu-s-1vcpu-1gb-tor1-01.ssh > cpec09435c3be97-cmc09435c3be95.cpe.net.cable.rogers.com.58902: Flags [P.], seq 2369420:2369640, ack 1261, win 501, length 220
09:49:18.748096 IP lamp-ubuntu-s-1vcpu-1gb-tor1-01.ssh > cpec09435c3be97-cmc09435c3be95.cpe.net.cable.rogers.com.58902: Flags [P.], seq 2369640:2369860, ack 1261, win 501, length 220
09:49:18.748196 IP lamp-ubuntu-s-1vcpu-1gb-tor1-01.ssh > cpec09435c3be97-cmc09435c3be95.cpe.net.cable.rogers.com.58902: Flags [P.], seq 2369860:2370080, ack 1261, win 501, length 220
09:49:18.748282 IP lamp-ubuntu-s-1vcpu-1gb-tor1-01.ssh > cpec09435c3be97-cmc09435c3be95.cpe.net.cable.rogers.com.58902: Flags [P.], seq 2370080:2370300, ack 1261, win 501, length 220
09:49:18.748346 IP lamp-ubuntu-s-1vcpu-1gb-tor1-01.ssh > cpec09435c3be97-cmc09435c3be95.cpe.net.cable.rogers.com.58902: Flags [P.], seq 2370300:2370520, ack 1261, win 501, length 220
09:49:18.748485 IP lamp-ubuntu-s-1vcpu-1gb-tor1-01.ssh > cpec09435c3be97-cmc09435c3be95.cpe.net.cable.rogers.com.58902: Flags [P.], seq 2370520:2370740, ack 1261, win 501, length 220
09:49:18.748549 IP lamp-ubuntu-s-1vcpu-1gb-tor1-01.ssh > cpec09435c3be97-cmc09435c3be95.cpe.net.cable.rogers.com.58902: Flags [P.], seq 2370740:2370960, ack 1261, win 501, length 220
09:49:18.748603 IP lamp-ubuntu-s-1vcpu-1gb-tor1-01.ssh > cpec09435c3be97-cmc09435c3be95.cpe.net.cable.rogers.com.58902: Flags [P.], seq 2370960:2371180, ack 1261, win 501, length 220
09:49:18.748659 IP lamp-ubuntu-s-1vcpu-1gb-tor1-01.ssh > cpec09435c3be97-cmc09435c3be95.cpe.net.cable.rogers.com.58902: Flags [P.], seq 2371180:2371400, ack 1261, win 501, length 220
09:49:18.748713 IP lamp-ubuntu-s-1vcpu-1gb-tor1-01.ssh > cpec09435c3be97-cmc09435c3be95.cpe.net.cable.rogers.com.58902: Flags [P.], seq 2371400:2371620, ack 1261, win 501, length 220
09:49:18.748769 IP lamp-ubuntu-s-1vcpu-1gb-tor1-01.ssh > cpec09435c3be97-cmc09435c3be95.cpe.net.cable.rogers.com.58902: Flags [P.], seq 2371620:2371840, ack 1261, win 501, length 220
09:49:18.748826 IP lamp-ubuntu-s-1vcpu-1gb-tor1-01.ssh > cpec09435c3be97-cmc09435c3be95.cpe.net.cable.rogers.com.58902: Flags [P.], seq 2371840:2372060, ack 1261, win 501, length 220
09:49:18.748880 IP lamp-ubuntu-s-1vcpu-1gb-tor1-01.ssh > cpec09435c3be97-cmc09435c3be95.cpe.net.cable.rogers.com.58902: Flags [P.], seq 2372060:2372280, ack 1261, win 501, length 220
09:49:18.748934 IP lamp-ubuntu-s-1vcpu-1gb-tor1-01.ssh > cpec09435c3be97-cmc09435c3be95.cpe.net.cable.rogers.com.58902: Flags [P.], seq 2372280:2372500, ack 1261, win 501, length 220
09:49:18.748991 IP lamp-ubuntu-s-1vcpu-1gb-tor1-01.ssh > cpec09435c3be97-cmc09435c3be95.cpe.net.cable.rogers.com.58902: Flags [P.], seq 2372500:2372720, ack 1261, win 501, length 220
09:49:18.749048 IP lamp-ubuntu-s-1vcpu-1gb-tor1-01.ssh > cpec09435c3be97-cmc09435c3be95.cpe.net.cable.rogers.com.58902: Flags [P.], seq 2372720:2372940, ack 1261, win 501, length 220
09:49:18.749106 IP lamp-ubuntu-s-1vcpu-1gb-tor1-01.ssh > cpec09435c3be97-cmc09435c3be95.cpe.net.cable.rogers.com.58902: Flags [P.], seq 2372940:2373160, ack 1261, win 501, length 220
09:49:18.749160 IP lamp-ubuntu-s-1vcpu-1gb-tor1-01.ssh > cpec09435c3be97-cmc09435c3be95.cpe.net.cable.rogers.com.58902: Flags [P.], seq 2373160:2373380, ack 1261, win 501, length 220
09:49:18.749213 IP lamp-ubuntu-s-1vcpu-1gb-tor1-01.ssh > cpec09435c3be97-cmc09435c3be95.cpe.net.cable.rogers.com.58902: Flags [P.], seq 2373380:2373600, ack 1261, win 501, length 220
09:49:18.749277 IP lamp-ubuntu-s-1vcpu-1gb-tor1-01.ssh > cpec09435c3be97-cmc09435c3be95.cpe.net.cable.rogers.com.58902: Flags [P.], seq 2373600:2373820, ack 1261, win 501, length 220
09:49:18.749372 IP lamp-ubuntu-s-1vcpu-1gb-tor1-01.ssh > cpec09435c3be97-cmc09435c3be95.cpe.net.cable.rogers.com.58902: Flags [P.], seq 2373820:2374040, ack 1261, win 501, length 220
09:49:18.749449 IP lamp-ubuntu-s-1vcpu-1gb-tor1-01.ssh > cpec09435c3be97-cmc09435c3be95.cpe.net.cable.rogers.com.58902: Flags [P.], seq 2374040:2374260, ack 1261, win 501, length 220
09:49:18.749534 IP lamp-ubuntu-s-1vcpu-1gb-tor1-01.ssh > cpec09435c3be97-cmc09435c3be95.cpe.net.cable.rogers.com.58902: Flags [P.], seq 2374260:2374480, ack 1261, win 501, length 220
09:49:18.749634 IP lamp-ubuntu-s-1vcpu-1gb-tor1-01.ssh > cpec09435c3be97-cmc09435c3be95.cpe.net.cable.rogers.com.58902: Flags [P.], seq 2374480:2374700, ack 1261, win 501, length 220
09:49:18.749716 IP lamp-ubuntu-s-1vcpu-1gb-tor1-01.ssh > cpec09435c3be97-cmc09435c3be95.cpe.net.cable.rogers.com.58902: Flags [P.], seq 2374700:2374920, ack 1261, win 501, length 220
09:49:18.749819 IP lamp-ubuntu-s-1vcpu-1gb-tor1-01.ssh > cpec09435c3be97-cmc09435c3be95.cpe.net.cable.rogers.com.58902: Flags [P.], seq 2374920:2375140, ack 1261, win 501, length 220
09:49:18.749900 IP lamp-ubuntu-s-1vcpu-1gb-tor1-01.ssh > cpec09435c3be97-cmc09435c3be95.cpe.net.cable.rogers.com.58902: Flags [P.], seq 2375140:2375360, ack 1261, win 501, length 220
09:49:18.749988 IP lamp-ubuntu-s-1vcpu-1gb-tor1-01.ssh > cpec09435c3be97-cmc09435c3be95.cpe.net.cable.rogers.com.58902: Flags [P.], seq 2375360:2375580, ack 1261, win 501, length 220
09:49:18.750018 IP cpec09435c3be97-cmc09435c3be95.cpe.net.cable.rogers.com.58902 > lamp-ubuntu-s-1vcpu-1gb-tor1-01.ssh: Flags [.], ack 2324696, win 1026, length 0
09:49:18.750088 IP cpec09435c3be97-cmc09435c3be95.cpe.net.cable.rogers.com.58902 > lamp-ubuntu-s-1vcpu-1gb-tor1-01.ssh: Flags [.], ack 2330580, win 1026, length 0
09:49:18.750088 IP cpec09435c3be97-cmc09435c3be95.cpe.net.cable.rogers.com.58902 > lamp-ubuntu-s-1vcpu-1gb-tor1-01.ssh: Flags [.], ack 2333000, win 1026, length 0
09:49:18.750206 IP lamp-ubuntu-s-1vcpu-1gb-tor1-01.ssh > cpec09435c3be97-cmc09435c3be95.cpe.net.cable.rogers.com.58902: Flags [P.], seq 2375580:2376296, ack 1261, win 501, length 716
09:49:18.750295 IP lamp-ubuntu-s-1vcpu-1gb-tor1-01.ssh > cpec09435c3be97-cmc09435c3be95.cpe.net.cable.rogers.com.58902: Flags [P.], seq 2376296:2376516, ack 1261, win 501, length 220
09:49:18.750372 IP lamp-ubuntu-s-1vcpu-1gb-tor1-01.ssh > cpec09435c3be97-cmc09435c3be95.cpe.net.cable.rogers.com.58902: Flags [P.], seq 2376516:2376736, ack 1261, win 501, length 220
09:49:18.750439 IP lamp-ubuntu-s-1vcpu-1gb-tor1-01.ssh > cpec09435c3be97-cmc09435c3be95.cpe.net.cable.rogers.com.58902: Flags [P.], seq 2376736:2376956, ack 1261, win 501, length 220
09:49:18.750528 IP lamp-ubuntu-s-1vcpu-1gb-tor1-01.ssh > cpec09435c3be97-cmc09435c3be95.cpe.net.cable.rogers.com.58902: Flags [P.], seq 2376956:2377176, ack 1261, win 501, length 220
09:49:18.750616 IP lamp-ubuntu-s-1vcpu-1gb-tor1-01.ssh > cpec09435c3be97-cmc09435c3be95.cpe.net.cable.rogers.com.58902: Flags [P.], seq 2377176:2377396, ack 1261, win 501, length 220
09:49:18.750706 IP lamp-ubuntu-s-1vcpu-1gb-tor1-01.ssh > cpec09435c3be97-cmc09435c3be95.cpe.net.cable.rogers.com.58902: Flags [P.], seq 2377396:2377616, ack 1261, win 501, length 220
09:49:18.750823 IP lamp-ubuntu-s-1vcpu-1gb-tor1-01.ssh > cpec09435c3be97-cmc09435c3be95.cpe.net.cable.rogers.com.58902: Flags [P.], seq 2377616:2377836, ack 1261, win 501, length 220
09:49:18.750890 IP lamp-ubuntu-s-1vcpu-1gb-tor1-01.ssh > cpec09435c3be97-cmc09435c3be95.cpe.net.cable.rogers.com.58902: Flags [P.], seq 2377836:2378056, ack 1261, win 501, length 220
09:49:18.750947 IP lamp-ubuntu-s-1vcpu-1gb-tor1-01.ssh > cpec09435c3be97-cmc09435c3be95.cpe.net.cable.rogers.com.58902: Flags [P.], seq 2378056:2378276, ack 1261, win 501, length 220
09:49:18.751012 IP lamp-ubuntu-s-1vcpu-1gb-tor1-01.ssh > cpec09435c3be97-cmc09435c3be95.cpe.net.cable.rogers.com.58902: Flags [P.], seq 2378276:2378496, ack 1261, win 501, length 220
09:49:18.751092 IP lamp-ubuntu-s-1vcpu-1gb-tor1-01.ssh > cpec09435c3be97-cmc09435c3be95.cpe.net.cable.rogers.com.58902: Flags [P.], seq 2378496:2378716, ack 1261, win 501, length 220
09:49:18.751169 IP lamp-ubuntu-s-1vcpu-1gb-tor1-01.ssh > cpec09435c3be97-cmc09435c3be95.cpe.net.cable.rogers.com.58902: Flags [P.], seq 2378716:2378936, ack 1261, win 501, length 220
09:49:18.751237 IP lamp-ubuntu-s-1vcpu-1gb-tor1-01.ssh > cpec09435c3be97-cmc09435c3be95.cpe.net.cable.rogers.com.58902: Flags [P.], seq 2378936:2379156, ack 1261, win 501, length 220
09:49:18.751337 IP lamp-ubuntu-s-1vcpu-1gb-tor1-01.ssh > cpec09435c3be97-cmc09435c3be95.cpe.net.cable.rogers.com.58902: Flags [P.], seq 2379156:2379376, ack 1261, win 501, length 220
09:49:18.751420 IP lamp-ubuntu-s-1vcpu-1gb-tor1-01.ssh > cpec09435c3be97-cmc09435c3be95.cpe.net.cable.rogers.com.58902: Flags [P.], seq 2379376:2379596, ack 1261, win 501, length 220
09:49:18.751481 IP lamp-ubuntu-s-1vcpu-1gb-tor1-01.ssh > cpec09435c3be97-cmc09435c3be95.cpe.net.cable.rogers.com.58902: Flags [P.], seq 2379596:2379816, ack 1261, win 501, length 220
09:49:18.751550 IP lamp-ubuntu-s-1vcpu-1gb-tor1-01.ssh > cpec09435c3be97-cmc09435c3be95.cpe.net.cable.rogers.com.58902: Flags [P.], seq 2379816:2380036, ack 1261, win 501, length 220
09:49:18.751634 IP lamp-ubuntu-s-1vcpu-1gb-tor1-01.ssh > cpec09435c3be97-cmc09435c3be95.cpe.net.cable.rogers.com.58902: Flags [P.], seq 2380036:2380256, ack 1261, win 501, length 220
09:49:18.751725 IP lamp-ubuntu-s-1vcpu-1gb-tor1-01.ssh > cpec09435c3be97-cmc09435c3be95.cpe.net.cable.rogers.com.58902: Flags [P.], seq 2380256:2380476, ack 1261, win 501, length 220
09:49:18.751809 IP lamp-ubuntu-s-1vcpu-1gb-tor1-01.ssh > cpec09435c3be97-cmc09435c3be95.cpe.net.cable.rogers.com.58902: Flags [P.], seq 2380476:2380696, ack 1261, win 501, length 220
09:49:18.751888 IP lamp-ubuntu-s-1vcpu-1gb-tor1-01.ssh > cpec09435c3be97-cmc09435c3be95.cpe.net.cable.rogers.com.58902: Flags [P.], seq 2380696:2380916, ack 1261, win 501, length 220
09:49:18.751973 IP lamp-ubuntu-s-1vcpu-1gb-tor1-01.ssh > cpec09435c3be97-cmc09435c3be95.cpe.net.cable.rogers.com.58902: Flags [P.], seq 2380916:2381136, ack 1261, win 501, length 220
09:49:18.752061 IP lamp-ubuntu-s-1vcpu-1gb-tor1-01.ssh > cpec09435c3be97-cmc09435c3be95.cpe.net.cable.rogers.com.58902: Flags [P.], seq 2381136:2381356, ack 1261, win 501, length 220
09:49:18.752147 IP lamp-ubuntu-s-1vcpu-1gb-tor1-01.ssh > cpec09435c3be97-cmc09435c3be95.cpe.net.cable.rogers.com.58902: Flags [P.], seq 2381356:2381576, ack 1261, win 501, length 220
09:49:18.752221 IP lamp-ubuntu-s-1vcpu-1gb-tor1-01.ssh > cpec09435c3be97-cmc09435c3be95.cpe.net.cable.rogers.com.58902: Flags [P.], seq 2381576:2381796, ack 1261, win 501, length 220
09:49:18.752285 IP lamp-ubuntu-s-1vcpu-1gb-tor1-01.ssh > cpec09435c3be97-cmc09435c3be95.cpe.net.cable.rogers.com.58902: Flags [P.], seq 2381796:2382016, ack 1261, win 501, length 220
09:49:18.752349 IP lamp-ubuntu-s-1vcpu-1gb-tor1-01.ssh > cpec09435c3be97-cmc09435c3be95.cpe.net.cable.rogers.com.58902: Flags [P.], seq 2382016:2382236, ack 1261, win 501, length 220
09:49:18.752415 IP lamp-ubuntu-s-1vcpu-1gb-tor1-01.ssh > cpec09435c3be97-cmc09435c3be95.cpe.net.cable.rogers.com.58902: Flags [P.], seq 2382236:2382456, ack 1261, win 501, length 220
09:49:18.752470 IP lamp-ubuntu-s-1vcpu-1gb-tor1-01.ssh > cpec09435c3be97-cmc09435c3be95.cpe.net.cable.rogers.com.58902: Flags [P.], seq 2382456:2382676, ack 1261, win 501, length 220
09:49:18.752530 IP lamp-ubuntu-s-1vcpu-1gb-tor1-01.ssh > cpec09435c3be97-cmc09435c3be95.cpe.net.cable.rogers.com.58902: Flags [P.], seq 2382676:2382896, ack 1261, win 501, length 220
09:49:18.752592 IP lamp-ubuntu-s-1vcpu-1gb-tor1-01.ssh > cpec09435c3be97-cmc09435c3be95.cpe.net.cable.rogers.com.58902: Flags [P.], seq 2382896:2383116, ack 1261, win 501, length 220
09:49:18.752649 IP lamp-ubuntu-s-1vcpu-1gb-tor1-01.ssh > cpec09435c3be97-cmc09435c3be95.cpe.net.cable.rogers.com.58902: Flags [P.], seq 2383116:2383336, ack 1261, win 501, length 220
09:49:18.752703 IP lamp-ubuntu-s-1vcpu-1gb-tor1-01.ssh > cpec09435c3be97-cmc09435c3be95.cpe.net.cable.rogers.com.58902: Flags [P.], seq 2383336:2383556, ack 1261, win 501, length 220
09:49:18.752759 IP lamp-ubuntu-s-1vcpu-1gb-tor1-01.ssh > cpec09435c3be97-cmc09435c3be95.cpe.net.cable.rogers.com.58902: Flags [P.], seq 2383556:2383776, ack 1261, win 501, length 220
09:49:18.752834 IP lamp-ubuntu-s-1vcpu-1gb-tor1-01.ssh > cpec09435c3be97-cmc09435c3be95.cpe.net.cable.rogers.com.58902: Flags [P.], seq 2383776:2383996, ack 1261, win 501, length 220
09:49:18.752910 IP lamp-ubuntu-s-1vcpu-1gb-tor1-01.ssh > cpec09435c3be97-cmc09435c3be95.cpe.net.cable.rogers.com.58902: Flags [P.], seq 2383996:2384216, ack 1261, win 501, length 220
09:49:18.752972 IP lamp-ubuntu-s-1vcpu-1gb-tor1-01.ssh > cpec09435c3be97-cmc09435c3be95.cpe.net.cable.rogers.com.58902: Flags [P.], seq 2384216:2384436, ack 1261, win 501, length 220
09:49:18.753030 IP lamp-ubuntu-s-1vcpu-1gb-tor1-01.ssh > cpec09435c3be97-cmc09435c3be95.cpe.net.cable.rogers.com.58902: Flags [P.], seq 2384436:2384656, ack 1261, win 501, length 220
09:49:18.753083 IP lamp-ubuntu-s-1vcpu-1gb-tor1-01.ssh > cpec09435c3be97-cmc09435c3be95.cpe.net.cable.rogers.com.58902: Flags [P.], seq 2384656:2384876, ack 1261, win 501, length 220
09:49:18.753138 IP lamp-ubuntu-s-1vcpu-1gb-tor1-01.ssh > cpec09435c3be97-cmc09435c3be95.cpe.net.cable.rogers.com.58902: Flags [P.], seq 2384876:2385096, ack 1261, win 501, length 220
09:49:18.753212 IP lamp-ubuntu-s-1vcpu-1gb-tor1-01.ssh > cpec09435c3be97-cmc09435c3be95.cpe.net.cable.rogers.com.58902: Flags [P.], seq 2385096:2385316, ack 1261, win 501, length 220
09:49:18.753271 IP lamp-ubuntu-s-1vcpu-1gb-tor1-01.ssh > cpec09435c3be97-cmc09435c3be95.cpe.net.cable.rogers.com.58902: Flags [P.], seq 2385316:2385536, ack 1261, win 501, length 220
09:49:18.753330 IP lamp-ubuntu-s-1vcpu-1gb-tor1-01.ssh > cpec09435c3be97-cmc09435c3be95.cpe.net.cable.rogers.com.58902: Flags [P.], seq 2385536:2385756, ack 1261, win 501, length 220
09:49:18.753400 IP lamp-ubuntu-s-1vcpu-1gb-tor1-01.ssh > cpec09435c3be97-cmc09435c3be95.cpe.net.cable.rogers.com.58902: Flags [P.], seq 2385756:2385976, ack 1261, win 501, length 220
09:49:18.753459 IP lamp-ubuntu-s-1vcpu-1gb-tor1-01.ssh > cpec09435c3be97-cmc09435c3be95.cpe.net.cable.rogers.com.58902: Flags [P.], seq 2385976:2386196, ack 1261, win 501, length 220
09:49:18.753519 IP lamp-ubuntu-s-1vcpu-1gb-tor1-01.ssh > cpec09435c3be97-cmc09435c3be95.cpe.net.cable.rogers.com.58902: Flags [P.], seq 2386196:2386416, ack 1261, win 501, length 220
09:49:18.753582 IP lamp-ubuntu-s-1vcpu-1gb-tor1-01.ssh > cpec09435c3be97-cmc09435c3be95.cpe.net.cable.rogers.com.58902: Flags [P.], seq 2386416:2386636, ack 1261, win 501, length 220
09:49:18.753659 IP lamp-ubuntu-s-1vcpu-1gb-tor1-01.ssh > cpec09435c3be97-cmc09435c3be95.cpe.net.cable.rogers.com.58902: Flags [P.], seq 2386636:2386856, ack 1261, win 501, length 220
09:49:18.753723 IP lamp-ubuntu-s-1vcpu-1gb-tor1-01.ssh > cpec09435c3be97-cmc09435c3be95.cpe.net.cable.rogers.com.58902: Flags [P.], seq 2386856:2387076, ack 1261, win 501, length 220
09:49:18.753799 IP lamp-ubuntu-s-1vcpu-1gb-tor1-01.ssh > cpec09435c3be97-cmc09435c3be95.cpe.net.cable.rogers.com.58902: Flags [P.], seq 2387076:2387296, ack 1261, win 501, length 220
09:49:18.753863 IP lamp-ubuntu-s-1vcpu-1gb-tor1-01.ssh > cpec09435c3be97-cmc09435c3be95.cpe.net.cable.rogers.com.58902: Flags [P.], seq 2387296:2387516, ack 1261, win 501, length 220
09:49:18.753927 IP lamp-ubuntu-s-1vcpu-1gb-tor1-01.ssh > cpec09435c3be97-cmc09435c3be95.cpe.net.cable.rogers.com.58902: Flags [P.], seq 2387516:2387736, ack 1261, win 501, length 220
09:49:18.753985 IP lamp-ubuntu-s-1vcpu-1gb-tor1-01.ssh > cpec09435c3be97-cmc09435c3be95.cpe.net.cable.rogers.com.58902: Flags [P.], seq 2387736:2387956, ack 1261, win 501, length 220
09:49:18.754043 IP lamp-ubuntu-s-1vcpu-1gb-tor1-01.ssh > cpec09435c3be97-cmc09435c3be95.cpe.net.cable.rogers.com.58902: Flags [P.], seq 2387956:2388176, ack 1261, win 501, length 220
09:49:18.754103 IP lamp-ubuntu-s-1vcpu-1gb-tor1-01.ssh > cpec09435c3be97-cmc09435c3be95.cpe.net.cable.rogers.com.58902: Flags [P.], seq 2388176:2388396, ack 1261, win 501, length 220
09:49:18.754163 IP lamp-ubuntu-s-1vcpu-1gb-tor1-01.ssh > cpec09435c3be97-cmc09435c3be95.cpe.net.cable.rogers.com.58902: Flags [P.], seq 2388396:2388616, ack 1261, win 501, length 220
09:49:18.754227 IP lamp-ubuntu-s-1vcpu-1gb-tor1-01.ssh > cpec09435c3be97-cmc09435c3be95.cpe.net.cable.rogers.com.58902: Flags [P.], seq 2388616:2388836, ack 1261, win 501, length 220
09:49:18.754284 IP lamp-ubuntu-s-1vcpu-1gb-tor1-01.ssh > cpec09435c3be97-cmc09435c3be95.cpe.net.cable.rogers.com.58902: Flags [P.], seq 2388836:2389056, ack 1261, win 501, length 220
09:49:18.754339 IP lamp-ubuntu-s-1vcpu-1gb-tor1-01.ssh > cpec09435c3be97-cmc09435c3be95.cpe.net.cable.rogers.com.58902: Flags [P.], seq 2389056:2389276, ack 1261, win 501, length 220
09:49:18.754396 IP lamp-ubuntu-s-1vcpu-1gb-tor1-01.ssh > cpec09435c3be97-cmc09435c3be95.cpe.net.cable.rogers.com.58902: Flags [P.], seq 2389276:2389496, ack 1261, win 501, length 220
09:49:18.754452 IP lamp-ubuntu-s-1vcpu-1gb-tor1-01.ssh > cpec09435c3be97-cmc09435c3be95.cpe.net.cable.rogers.com.58902: Flags [P.], seq 2389496:2389716, ack 1261, win 501, length 220
09:49:18.754516 IP lamp-ubuntu-s-1vcpu-1gb-tor1-01.ssh > cpec09435c3be97-cmc09435c3be95.cpe.net.cable.rogers.com.58902: Flags [P.], seq 2389716:2389936, ack 1261, win 501, length 220
09:49:18.754577 IP lamp-ubuntu-s-1vcpu-1gb-tor1-01.ssh > cpec09435c3be97-cmc09435c3be95.cpe.net.cable.rogers.com.58902: Flags [P.], seq 2389936:2390156, ack 1261, win 501, length 220
09:49:18.754648 IP lamp-ubuntu-s-1vcpu-1gb-tor1-01.ssh > cpec09435c3be97-cmc09435c3be95.cpe.net.cable.rogers.com.58902: Flags [P.], seq 2390156:2390376, ack 1261, win 501, length 220
09:49:18.754708 IP lamp-ubuntu-s-1vcpu-1gb-tor1-01.ssh > cpec09435c3be97-cmc09435c3be95.cpe.net.cable.rogers.com.58902: Flags [P.], seq 2390376:2390596, ack 1261, win 501, length 220
09:49:18.754783 IP lamp-ubuntu-s-1vcpu-1gb-tor1-01.ssh > cpec09435c3be97-cmc09435c3be95.cpe.net.cable.rogers.com.58902: Flags [P.], seq 2390596:2390816, ack 1261, win 501, length 220
09:49:18.754870 IP lamp-ubuntu-s-1vcpu-1gb-tor1-01.ssh > cpec09435c3be97-cmc09435c3be95.cpe.net.cable.rogers.com.58902: Flags [P.], seq 2390816:2391036, ack 1261, win 501, length 220
09:49:18.754935 IP lamp-ubuntu-s-1vcpu-1gb-tor1-01.ssh > cpec09435c3be97-cmc09435c3be95.cpe.net.cable.rogers.com.58902: Flags [P.], seq 2391036:2391256, ack 1261, win 501, length 220
09:49:18.754990 IP lamp-ubuntu-s-1vcpu-1gb-tor1-01.ssh > cpec09435c3be97-cmc09435c3be95.cpe.net.cable.rogers.com.58902: Flags [P.], seq 2391256:2391476, ack 1261, win 501, length 220
09:49:18.755054 IP lamp-ubuntu-s-1vcpu-1gb-tor1-01.ssh > cpec09435c3be97-cmc09435c3be95.cpe.net.cable.rogers.com.58902: Flags [P.], seq 2391476:2391696, ack 1261, win 501, length 220
09:49:18.755143 IP lamp-ubuntu-s-1vcpu-1gb-tor1-01.ssh > cpec09435c3be97-cmc09435c3be95.cpe.net.cable.rogers.com.58902: Flags [P.], seq 2391696:2391916, ack 1261, win 501, length 220
09:49:18.755222 IP lamp-ubuntu-s-1vcpu-1gb-tor1-01.ssh > cpec09435c3be97-cmc09435c3be95.cpe.net.cable.rogers.com.58902: Flags [P.], seq 2391916:2392136, ack 1261, win 501, length 220
09:49:18.755293 IP lamp-ubuntu-s-1vcpu-1gb-tor1-01.ssh > cpec09435c3be97-cmc09435c3be95.cpe.net.cable.rogers.com.58902: Flags [P.], seq 2392136:2392356, ack 1261, win 501, length 220
09:49:18.755367 IP lamp-ubuntu-s-1vcpu-1gb-tor1-01.ssh > cpec09435c3be97-cmc09435c3be95.cpe.net.cable.rogers.com.58902: Flags [P.], seq 2392356:2392576, ack 1261, win 501, length 220
09:49:18.755440 IP lamp-ubuntu-s-1vcpu-1gb-tor1-01.ssh > cpec09435c3be97-cmc09435c3be95.cpe.net.cable.rogers.com.58902: Flags [P.], seq 2392576:2392796, ack 1261, win 501, length 220
09:49:18.755507 IP lamp-ubuntu-s-1vcpu-1gb-tor1-01.ssh > cpec09435c3be97-cmc09435c3be95.cpe.net.cable.rogers.com.58902: Flags [P.], seq 2392796:2393016, ack 1261, win 501, length 220
09:49:18.755630 IP lamp-ubuntu-s-1vcpu-1gb-tor1-01.ssh > cpec09435c3be97-cmc09435c3be95.cpe.net.cable.rogers.com.58902: Flags [P.], seq 2393016:2393236, ack 1261, win 501, length 220
09:49:18.755704 IP lamp-ubuntu-s-1vcpu-1gb-tor1-01.ssh > cpec09435c3be97-cmc09435c3be95.cpe.net.cable.rogers.com.58902: Flags [P.], seq 2393236:2393456, ack 1261, win 501, length 220
09:49:18.755828 IP lamp-ubuntu-s-1vcpu-1gb-tor1-01.ssh > cpec09435c3be97-cmc09435c3be95.cpe.net.cable.rogers.com.58902: Flags [P.], seq 2393456:2393676, ack 1261, win 501, length 220
09:49:18.755919 IP lamp-ubuntu-s-1vcpu-1gb-tor1-01.ssh > cpec09435c3be97-cmc09435c3be95.cpe.net.cable.rogers.com.58902: Flags [P.], seq 2393676:2393896, ack 1261, win 501, length 220
09:49:18.755999 IP lamp-ubuntu-s-1vcpu-1gb-tor1-01.ssh > cpec09435c3be97-cmc09435c3be95.cpe.net.cable.rogers.com.58902: Flags [P.], seq 2393896:2394116, ack 1261, win 501, length 220
09:49:18.756099 IP lamp-ubuntu-s-1vcpu-1gb-tor1-01.ssh > cpec09435c3be97-cmc09435c3be95.cpe.net.cable.rogers.com.58902: Flags [P.], seq 2394116:2394336, ack 1261, win 501, length 220
09:49:18.756196 IP lamp-ubuntu-s-1vcpu-1gb-tor1-01.ssh > cpec09435c3be97-cmc09435c3be95.cpe.net.cable.rogers.com.58902: Flags [P.], seq 2394336:2394556, ack 1261, win 501, length 220
09:49:18.756271 IP lamp-ubuntu-s-1vcpu-1gb-tor1-01.ssh > cpec09435c3be97-cmc09435c3be95.cpe.net.cable.rogers.com.58902: Flags [P.], seq 2394556:2394776, ack 1261, win 501, length 220
09:49:18.756334 IP lamp-ubuntu-s-1vcpu-1gb-tor1-01.ssh > cpec09435c3be97-cmc09435c3be95.cpe.net.cable.rogers.com.58902: Flags [P.], seq 2394776:2394996, ack 1261, win 501, length 220
09:49:18.756403 IP lamp-ubuntu-s-1vcpu-1gb-tor1-01.ssh > cpec09435c3be97-cmc09435c3be95.cpe.net.cable.rogers.com.58902: Flags [P.], seq 2394996:2395216, ack 1261, win 501, length 220
09:49:18.756475 IP lamp-ubuntu-s-1vcpu-1gb-tor1-01.ssh > cpec09435c3be97-cmc09435c3be95.cpe.net.cable.rogers.com.58902: Flags [P.], seq 2395216:2395436, ack 1261, win 501, length 220
09:49:18.756539 IP lamp-ubuntu-s-1vcpu-1gb-tor1-01.ssh > cpec09435c3be97-cmc09435c3be95.cpe.net.cable.rogers.com.58902: Flags [P.], seq 2395436:2395656, ack 1261, win 501, length 220
09:49:18.756596 IP lamp-ubuntu-s-1vcpu-1gb-tor1-01.ssh > cpec09435c3be97-cmc09435c3be95.cpe.net.cable.rogers.com.58902: Flags [P.], seq 2395656:2395876, ack 1261, win 501, length 220
09:49:18.756655 IP lamp-ubuntu-s-1vcpu-1gb-tor1-01.ssh > cpec09435c3be97-cmc09435c3be95.cpe.net.cable.rogers.com.58902: Flags [P.], seq 2395876:2396096, ack 1261, win 501, length 220
09:49:18.756710 IP lamp-ubuntu-s-1vcpu-1gb-tor1-01.ssh > cpec09435c3be97-cmc09435c3be95.cpe.net.cable.rogers.com.58902: Flags [P.], seq 2396096:2396316, ack 1261, win 501, length 220
09:49:18.756801 IP lamp-ubuntu-s-1vcpu-1gb-tor1-01.ssh > cpec09435c3be97-cmc09435c3be95.cpe.net.cable.rogers.com.58902: Flags [P.], seq 2396316:2396536, ack 1261, win 501, length 220
09:49:18.756863 IP lamp-ubuntu-s-1vcpu-1gb-tor1-01.ssh > cpec09435c3be97-cmc09435c3be95.cpe.net.cable.rogers.com.58902: Flags [P.], seq 2396536:2396756, ack 1261, win 501, length 220
09:49:18.756925 IP lamp-ubuntu-s-1vcpu-1gb-tor1-01.ssh > cpec09435c3be97-cmc09435c3be95.cpe.net.cable.rogers.com.58902: Flags [P.], seq 2396756:2396976, ack 1261, win 501, length 220
09:49:18.756980 IP lamp-ubuntu-s-1vcpu-1gb-tor1-01.ssh > cpec09435c3be97-cmc09435c3be95.cpe.net.cable.rogers.com.58902: Flags [P.], seq 2396976:2397196, ack 1261, win 501, length 220
09:49:18.757037 IP lamp-ubuntu-s-1vcpu-1gb-tor1-01.ssh > cpec09435c3be97-cmc09435c3be95.cpe.net.cable.rogers.com.58902: Flags [P.], seq 2397196:2397416, ack 1261, win 501, length 220
09:49:18.757092 IP lamp-ubuntu-s-1vcpu-1gb-tor1-01.ssh > cpec09435c3be97-cmc09435c3be95.cpe.net.cable.rogers.com.58902: Flags [P.], seq 2397416:2397636, ack 1261, win 501, length 220
09:49:18.757151 IP lamp-ubuntu-s-1vcpu-1gb-tor1-01.ssh > cpec09435c3be97-cmc09435c3be95.cpe.net.cable.rogers.com.58902: Flags [P.], seq 2397636:2397856, ack 1261, win 501, length 220
09:49:18.757204 IP lamp-ubuntu-s-1vcpu-1gb-tor1-01.ssh > cpec09435c3be97-cmc09435c3be95.cpe.net.cable.rogers.com.58902: Flags [P.], seq 2397856:2398076, ack 1261, win 501, length 220
09:49:18.757261 IP lamp-ubuntu-s-1vcpu-1gb-tor1-01.ssh > cpec09435c3be97-cmc09435c3be95.cpe.net.cable.rogers.com.58902: Flags [P.], seq 2398076:2398296, ack 1261, win 501, length 220
09:49:18.757314 IP lamp-ubuntu-s-1vcpu-1gb-tor1-01.ssh > cpec09435c3be97-cmc09435c3be95.cpe.net.cable.rogers.com.58902: Flags [P.], seq 2398296:2398516, ack 1261, win 501, length 220
09:49:18.757380 IP lamp-ubuntu-s-1vcpu-1gb-tor1-01.ssh > cpec09435c3be97-cmc09435c3be95.cpe.net.cable.rogers.com.58902: Flags [P.], seq 2398516:2398736, ack 1261, win 501, length 220
09:49:18.757448 IP lamp-ubuntu-s-1vcpu-1gb-tor1-01.ssh > cpec09435c3be97-cmc09435c3be95.cpe.net.cable.rogers.com.58902: Flags [P.], seq 2398736:2398956, ack 1261, win 501, length 220
09:49:18.757548 IP lamp-ubuntu-s-1vcpu-1gb-tor1-01.ssh > cpec09435c3be97-cmc09435c3be95.cpe.net.cable.rogers.com.58902: Flags [P.], seq 2398956:2399176, ack 1261, win 501, length 220
09:49:18.757647 IP lamp-ubuntu-s-1vcpu-1gb-tor1-01.ssh > cpec09435c3be97-cmc09435c3be95.cpe.net.cable.rogers.com.58902: Flags [P.], seq 2399176:2399396, ack 1261, win 501, length 220
09:49:18.757710 IP lamp-ubuntu-s-1vcpu-1gb-tor1-01.ssh > cpec09435c3be97-cmc09435c3be95.cpe.net.cable.rogers.com.58902: Flags [P.], seq 2399396:2399616, ack 1261, win 501, length 220
09:49:18.757782 IP lamp-ubuntu-s-1vcpu-1gb-tor1-01.ssh > cpec09435c3be97-cmc09435c3be95.cpe.net.cable.rogers.com.58902: Flags [P.], seq 2399616:2399836, ack 1261, win 501, length 220
09:49:18.757837 IP lamp-ubuntu-s-1vcpu-1gb-tor1-01.ssh > cpec09435c3be97-cmc09435c3be95.cpe.net.cable.rogers.com.58902: Flags [P.], seq 2399836:2400056, ack 1261, win 501, length 220
09:49:18.757890 IP lamp-ubuntu-s-1vcpu-1gb-tor1-01.ssh > cpec09435c3be97-cmc09435c3be95.cpe.net.cable.rogers.com.58902: Flags [P.], seq 2400056:2400276, ack 1261, win 501, length 220
09:49:18.757948 IP lamp-ubuntu-s-1vcpu-1gb-tor1-01.ssh > cpec09435c3be97-cmc09435c3be95.cpe.net.cable.rogers.com.58902: Flags [P.], seq 2400276:2400496, ack 1261, win 501, length 220
09:49:18.758007 IP lamp-ubuntu-s-1vcpu-1gb-tor1-01.ssh > cpec09435c3be97-cmc09435c3be95.cpe.net.cable.rogers.com.58902: Flags [P.], seq 2400496:2400716, ack 1261, win 501, length 220
09:49:18.758095 IP cpec09435c3be97-cmc09435c3be95.cpe.net.cable.rogers.com.58902 > lamp-ubuntu-s-1vcpu-1gb-tor1-01.ssh: Flags [.], ack 2339380, win 1026, length 0
09:49:18.758143 IP cpec09435c3be97-cmc09435c3be95.cpe.net.cable.rogers.com.58902 > lamp-ubuntu-s-1vcpu-1gb-tor1-01.ssh: Flags [.], ack 2352260, win 1026, length 0
09:49:18.758143 IP cpec09435c3be97-cmc09435c3be95.cpe.net.cable.rogers.com.58902 > lamp-ubuntu-s-1vcpu-1gb-tor1-01.ssh: Flags [.], ack 2357980, win 1026, length 0
09:49:18.758220 IP cpec09435c3be97-cmc09435c3be95.cpe.net.cable.rogers.com.58902 > lamp-ubuntu-s-1vcpu-1gb-tor1-01.ssh: Flags [P.], seq 1261:1297, ack 2357980, win 1026, length 36
09:49:18.758220 IP cpec09435c3be97-cmc09435c3be95.cpe.net.cable.rogers.com.58902 > lamp-ubuntu-s-1vcpu-1gb-tor1-01.ssh: Flags [.], ack 2360840, win 1026, length 0
09:49:18.758220 IP cpec09435c3be97-cmc09435c3be95.cpe.net.cable.rogers.com.58902 > lamp-ubuntu-s-1vcpu-1gb-tor1-01.ssh: Flags [P.], seq 1297:1333, ack 2360840, win 1026, length 36
09:49:18.758371 IP lamp-ubuntu-s-1vcpu-1gb-tor1-01.ssh > cpec09435c3be97-cmc09435c3be95.cpe.net.cable.rogers.com.58902: Flags [.], ack 1333, win 501, length 0
^C
11125 packets captured
11130 packets received by filter
3 packets dropped by kernel
