10:01:05.129689 IP lamp-ubuntu-s-1vcpu-1gb-tor1-01.ssh > cpec09435c3be97-cmc09435c3be95.cpe.net.cable.rogers.com.58902: Flags [P.], seq 4240768:4240988, ack 2341, win 501, length 220
10:01:05.129794 IP lamp-ubuntu-s-1vcpu-1gb-tor1-01.ssh > cpec09435c3be97-cmc09435c3be95.cpe.net.cable.rogers.com.58902: Flags [P.], seq 4240988:4241208, ack 2341, win 501, length 220
10:01:05.129907 IP lamp-ubuntu-s-1vcpu-1gb-tor1-01.ssh > cpec09435c3be97-cmc09435c3be95.cpe.net.cable.rogers.com.58902: Flags [P.], seq 4241208:4241428, ack 2341, win 501, length 220
10:01:05.129996 IP lamp-ubuntu-s-1vcpu-1gb-tor1-01.ssh > cpec09435c3be97-cmc09435c3be95.cpe.net.cable.rogers.com.58902: Flags [P.], seq 4241428:4241648, ack 2341, win 501, length 220
10:01:05.130094 IP lamp-ubuntu-s-1vcpu-1gb-tor1-01.ssh > cpec09435c3be97-cmc09435c3be95.cpe.net.cable.rogers.com.58902: Flags [P.], seq 4241648:4241868, ack 2341, win 501, length 220
10:01:05.130175 IP lamp-ubuntu-s-1vcpu-1gb-tor1-01.ssh > cpec09435c3be97-cmc09435c3be95.cpe.net.cable.rogers.com.58902: Flags [P.], seq 4241868:4242088, ack 2341, win 501, length 220
10:01:05.130252 IP lamp-ubuntu-s-1vcpu-1gb-tor1-01.ssh > cpec09435c3be97-cmc09435c3be95.cpe.net.cable.rogers.com.58902: Flags [P.], seq 4242088:4242308, ack 2341, win 501, length 220
10:01:05.130317 IP lamp-ubuntu-s-1vcpu-1gb-tor1-01.ssh > cpec09435c3be97-cmc09435c3be95.cpe.net.cable.rogers.com.58902: Flags [P.], seq 4242308:4242528, ack 2341, win 501, length 220
10:01:05.130383 IP lamp-ubuntu-s-1vcpu-1gb-tor1-01.ssh > cpec09435c3be97-cmc09435c3be95.cpe.net.cable.rogers.com.58902: Flags [P.], seq 4242528:4242748, ack 2341, win 501, length 220
10:01:05.130442 IP lamp-ubuntu-s-1vcpu-1gb-tor1-01.ssh > cpec09435c3be97-cmc09435c3be95.cpe.net.cable.rogers.com.58902: Flags [P.], seq 4242748:4242968, ack 2341, win 501, length 220
10:01:05.130498 IP lamp-ubuntu-s-1vcpu-1gb-tor1-01.ssh > cpec09435c3be97-cmc09435c3be95.cpe.net.cable.rogers.com.58902: Flags [P.], seq 4242968:4243188, ack 2341, win 501, length 220
10:01:05.130553 IP lamp-ubuntu-s-1vcpu-1gb-tor1-01.ssh > cpec09435c3be97-cmc09435c3be95.cpe.net.cable.rogers.com.58902: Flags [P.], seq 4243188:4243408, ack 2341, win 501, length 220
10:01:05.130612 IP lamp-ubuntu-s-1vcpu-1gb-tor1-01.ssh > cpec09435c3be97-cmc09435c3be95.cpe.net.cable.rogers.com.58902: Flags [P.], seq 4243408:4243628, ack 2341, win 501, length 220
10:01:05.130785 IP lamp-ubuntu-s-1vcpu-1gb-tor1-01.ssh > cpec09435c3be97-cmc09435c3be95.cpe.net.cable.rogers.com.58902: Flags [P.], seq 4243628:4243848, ack 2341, win 501, length 220
10:01:05.130874 IP lamp-ubuntu-s-1vcpu-1gb-tor1-01.ssh > cpec09435c3be97-cmc09435c3be95.cpe.net.cable.rogers.com.58902: Flags [P.], seq 4243848:4244068, ack 2341, win 501, length 220
10:01:05.130987 IP lamp-ubuntu-s-1vcpu-1gb-tor1-01.ssh > cpec09435c3be97-cmc09435c3be95.cpe.net.cable.rogers.com.58902: Flags [P.], seq 4244068:4244288, ack 2341, win 501, length 220
10:01:05.131099 IP lamp-ubuntu-s-1vcpu-1gb-tor1-01.ssh > cpec09435c3be97-cmc09435c3be95.cpe.net.cable.rogers.com.58902: Flags [P.], seq 4244288:4244508, ack 2341, win 501, length 220
10:01:05.131199 IP lamp-ubuntu-s-1vcpu-1gb-tor1-01.ssh > cpec09435c3be97-cmc09435c3be95.cpe.net.cable.rogers.com.58902: Flags [P.], seq 4244508:4244728, ack 2341, win 501, length 220
10:01:05.131293 IP lamp-ubuntu-s-1vcpu-1gb-tor1-01.ssh > cpec09435c3be97-cmc09435c3be95.cpe.net.cable.rogers.com.58902: Flags [P.], seq 4244728:4244948, ack 2341, win 501, length 220
10:01:05.131388 IP lamp-ubuntu-s-1vcpu-1gb-tor1-01.ssh > cpec09435c3be97-cmc09435c3be95.cpe.net.cable.rogers.com.58902: Flags [P.], seq 4244948:4245168, ack 2341, win 501, length 220
10:01:05.131483 IP lamp-ubuntu-s-1vcpu-1gb-tor1-01.ssh > cpec09435c3be97-cmc09435c3be95.cpe.net.cable.rogers.com.58902: Flags [P.], seq 4245168:4245388, ack 2341, win 501, length 220
10:01:05.131573 IP lamp-ubuntu-s-1vcpu-1gb-tor1-01.ssh > cpec09435c3be97-cmc09435c3be95.cpe.net.cable.rogers.com.58902: Flags [P.], seq 4245388:4245608, ack 2341, win 501, length 220
10:01:05.131646 IP lamp-ubuntu-s-1vcpu-1gb-tor1-01.ssh > cpec09435c3be97-cmc09435c3be95.cpe.net.cable.rogers.com.58902: Flags [P.], seq 4245608:4245828, ack 2341, win 501, length 220
10:01:05.131721 IP lamp-ubuntu-s-1vcpu-1gb-tor1-01.ssh > cpec09435c3be97-cmc09435c3be95.cpe.net.cable.rogers.com.58902: Flags [P.], seq 4245828:4246048, ack 2341, win 501, length 220
10:01:05.131819 IP lamp-ubuntu-s-1vcpu-1gb-tor1-01.ssh > cpec09435c3be97-cmc09435c3be95.cpe.net.cable.rogers.com.58902: Flags [P.], seq 4246048:4246268, ack 2341, win 501, length 220
10:01:05.131925 IP lamp-ubuntu-s-1vcpu-1gb-tor1-01.ssh > cpec09435c3be97-cmc09435c3be95.cpe.net.cable.rogers.com.58902: Flags [P.], seq 4246268:4246488, ack 2341, win 501, length 220
10:01:05.132143 IP lamp-ubuntu-s-1vcpu-1gb-tor1-01.ssh > cpec09435c3be97-cmc09435c3be95.cpe.net.cable.rogers.com.58902: Flags [P.], seq 4246488:4246708, ack 2341, win 501, length 220
10:01:05.132240 IP lamp-ubuntu-s-1vcpu-1gb-tor1-01.ssh > cpec09435c3be97-cmc09435c3be95.cpe.net.cable.rogers.com.58902: Flags [P.], seq 4246708:4246928, ack 2341, win 501, length 220
10:01:05.132329 IP lamp-ubuntu-s-1vcpu-1gb-tor1-01.ssh > cpec09435c3be97-cmc09435c3be95.cpe.net.cable.rogers.com.58902: Flags [P.], seq 4246928:4247148, ack 2341, win 501, length 220
10:01:05.132387 IP lamp-ubuntu-s-1vcpu-1gb-tor1-01.ssh > cpec09435c3be97-cmc09435c3be95.cpe.net.cable.rogers.com.58902: Flags [P.], seq 4247148:4247368, ack 2341, win 501, length 220
10:01:05.132446 IP lamp-ubuntu-s-1vcpu-1gb-tor1-01.ssh > cpec09435c3be97-cmc09435c3be95.cpe.net.cable.rogers.com.58902: Flags [P.], seq 4247368:4247588, ack 2341, win 501, length 220
10:01:05.132504 IP lamp-ubuntu-s-1vcpu-1gb-tor1-01.ssh > cpec09435c3be97-cmc09435c3be95.cpe.net.cable.rogers.com.58902: Flags [P.], seq 4247588:4247808, ack 2341, win 501, length 220
10:01:05.132563 IP lamp-ubuntu-s-1vcpu-1gb-tor1-01.ssh > cpec09435c3be97-cmc09435c3be95.cpe.net.cable.rogers.com.58902: Flags [P.], seq 4247808:4248028, ack 2341, win 501, length 220
10:01:05.132619 IP lamp-ubuntu-s-1vcpu-1gb-tor1-01.ssh > cpec09435c3be97-cmc09435c3be95.cpe.net.cable.rogers.com.58902: Flags [P.], seq 4248028:4248248, ack 2341, win 501, length 220
10:01:05.132674 IP lamp-ubuntu-s-1vcpu-1gb-tor1-01.ssh > cpec09435c3be97-cmc09435c3be95.cpe.net.cable.rogers.com.58902: Flags [P.], seq 4248248:4248468, ack 2341, win 501, length 220
10:01:05.132729 IP lamp-ubuntu-s-1vcpu-1gb-tor1-01.ssh > cpec09435c3be97-cmc09435c3be95.cpe.net.cable.rogers.com.58902: Flags [P.], seq 4248468:4248688, ack 2341, win 501, length 220
10:01:05.132793 IP lamp-ubuntu-s-1vcpu-1gb-tor1-01.ssh > cpec09435c3be97-cmc09435c3be95.cpe.net.cable.rogers.com.58902: Flags [P.], seq 4248688:4248908, ack 2341, win 501, length 220
10:01:05.132851 IP lamp-ubuntu-s-1vcpu-1gb-tor1-01.ssh > cpec09435c3be97-cmc09435c3be95.cpe.net.cable.rogers.com.58902: Flags [P.], seq 4248908:4249128, ack 2341, win 501, length 220
10:01:05.132915 IP lamp-ubuntu-s-1vcpu-1gb-tor1-01.ssh > cpec09435c3be97-cmc09435c3be95.cpe.net.cable.rogers.com.58902: Flags [P.], seq 4249128:4249348, ack 2341, win 501, length 220
10:01:05.132972 IP lamp-ubuntu-s-1vcpu-1gb-tor1-01.ssh > cpec09435c3be97-cmc09435c3be95.cpe.net.cable.rogers.com.58902: Flags [P.], seq 4249348:4249568, ack 2341, win 501, length 220
10:01:05.133028 IP lamp-ubuntu-s-1vcpu-1gb-tor1-01.ssh > cpec09435c3be97-cmc09435c3be95.cpe.net.cable.rogers.com.58902: Flags [P.], seq 4249568:4249788, ack 2341, win 501, length 220
10:01:05.133085 IP lamp-ubuntu-s-1vcpu-1gb-tor1-01.ssh > cpec09435c3be97-cmc09435c3be95.cpe.net.cable.rogers.com.58902: Flags [P.], seq 4249788:4250008, ack 2341, win 501, length 220
10:01:05.133144 IP lamp-ubuntu-s-1vcpu-1gb-tor1-01.ssh > cpec09435c3be97-cmc09435c3be95.cpe.net.cable.rogers.com.58902: Flags [P.], seq 4250008:4250228, ack 2341, win 501, length 220
10:01:05.133198 IP lamp-ubuntu-s-1vcpu-1gb-tor1-01.ssh > cpec09435c3be97-cmc09435c3be95.cpe.net.cable.rogers.com.58902: Flags [P.], seq 4250228:4250448, ack 2341, win 501, length 220
10:01:05.133261 IP lamp-ubuntu-s-1vcpu-1gb-tor1-01.ssh > cpec09435c3be97-cmc09435c3be95.cpe.net.cable.rogers.com.58902: Flags [P.], seq 4250448:4250668, ack 2341, win 501, length 220
10:01:05.133317 IP lamp-ubuntu-s-1vcpu-1gb-tor1-01.ssh > cpec09435c3be97-cmc09435c3be95.cpe.net.cable.rogers.com.58902: Flags [P.], seq 4250668:4250888, ack 2341, win 501, length 220
10:01:05.133373 IP lamp-ubuntu-s-1vcpu-1gb-tor1-01.ssh > cpec09435c3be97-cmc09435c3be95.cpe.net.cable.rogers.com.58902: Flags [P.], seq 4250888:4251108, ack 2341, win 501, length 220
10:01:05.133428 IP lamp-ubuntu-s-1vcpu-1gb-tor1-01.ssh > cpec09435c3be97-cmc09435c3be95.cpe.net.cable.rogers.com.58902: Flags [P.], seq 4251108:4251328, ack 2341, win 501, length 220
10:01:05.133487 IP lamp-ubuntu-s-1vcpu-1gb-tor1-01.ssh > cpec09435c3be97-cmc09435c3be95.cpe.net.cable.rogers.com.58902: Flags [P.], seq 4251328:4251548, ack 2341, win 501, length 220
10:01:05.133542 IP lamp-ubuntu-s-1vcpu-1gb-tor1-01.ssh > cpec09435c3be97-cmc09435c3be95.cpe.net.cable.rogers.com.58902: Flags [P.], seq 4251548:4251768, ack 2341, win 501, length 220
10:01:05.133601 IP lamp-ubuntu-s-1vcpu-1gb-tor1-01.ssh > cpec09435c3be97-cmc09435c3be95.cpe.net.cable.rogers.com.58902: Flags [P.], seq 4251768:4251988, ack 2341, win 501, length 220
10:01:05.133655 IP lamp-ubuntu-s-1vcpu-1gb-tor1-01.ssh > cpec09435c3be97-cmc09435c3be95.cpe.net.cable.rogers.com.58902: Flags [P.], seq 4251988:4252208, ack 2341, win 501, length 220
10:01:05.133730 IP lamp-ubuntu-s-1vcpu-1gb-tor1-01.ssh > cpec09435c3be97-cmc09435c3be95.cpe.net.cable.rogers.com.58902: Flags [P.], seq 4252208:4252428, ack 2341, win 501, length 220
10:01:05.133806 IP lamp-ubuntu-s-1vcpu-1gb-tor1-01.ssh > cpec09435c3be97-cmc09435c3be95.cpe.net.cable.rogers.com.58902: Flags [P.], seq 4252428:4252648, ack 2341, win 501, length 220
10:01:05.133870 IP lamp-ubuntu-s-1vcpu-1gb-tor1-01.ssh > cpec09435c3be97-cmc09435c3be95.cpe.net.cable.rogers.com.58902: Flags [P.], seq 4252648:4252868, ack 2341, win 501, length 220
10:01:05.133924 IP lamp-ubuntu-s-1vcpu-1gb-tor1-01.ssh > cpec09435c3be97-cmc09435c3be95.cpe.net.cable.rogers.com.58902: Flags [P.], seq 4252868:4253088, ack 2341, win 501, length 220
10:01:05.133978 IP lamp-ubuntu-s-1vcpu-1gb-tor1-01.ssh > cpec09435c3be97-cmc09435c3be95.cpe.net.cable.rogers.com.58902: Flags [P.], seq 4253088:4253308, ack 2341, win 501, length 220
10:01:05.134038 IP lamp-ubuntu-s-1vcpu-1gb-tor1-01.ssh > cpec09435c3be97-cmc09435c3be95.cpe.net.cable.rogers.com.58902: Flags [P.], seq 4253308:4253528, ack 2341, win 501, length 220
10:01:05.134091 IP lamp-ubuntu-s-1vcpu-1gb-tor1-01.ssh > cpec09435c3be97-cmc09435c3be95.cpe.net.cable.rogers.com.58902: Flags [P.], seq 4253528:4253748, ack 2341, win 501, length 220
10:01:05.134146 IP lamp-ubuntu-s-1vcpu-1gb-tor1-01.ssh > cpec09435c3be97-cmc09435c3be95.cpe.net.cable.rogers.com.58902: Flags [P.], seq 4253748:4253968, ack 2341, win 501, length 220
10:01:05.134202 IP lamp-ubuntu-s-1vcpu-1gb-tor1-01.ssh > cpec09435c3be97-cmc09435c3be95.cpe.net.cable.rogers.com.58902: Flags [P.], seq 4253968:4254188, ack 2341, win 501, length 220
10:01:05.134256 IP lamp-ubuntu-s-1vcpu-1gb-tor1-01.ssh > cpec09435c3be97-cmc09435c3be95.cpe.net.cable.rogers.com.58902: Flags [P.], seq 4254188:4254408, ack 2341, win 501, length 220
10:01:05.134314 IP lamp-ubuntu-s-1vcpu-1gb-tor1-01.ssh > cpec09435c3be97-cmc09435c3be95.cpe.net.cable.rogers.com.58902: Flags [P.], seq 4254408:4254628, ack 2341, win 501, length 220
10:01:05.134369 IP lamp-ubuntu-s-1vcpu-1gb-tor1-01.ssh > cpec09435c3be97-cmc09435c3be95.cpe.net.cable.rogers.com.58902: Flags [P.], seq 4254628:4254848, ack 2341, win 501, length 220
10:01:05.134424 IP lamp-ubuntu-s-1vcpu-1gb-tor1-01.ssh > cpec09435c3be97-cmc09435c3be95.cpe.net.cable.rogers.com.58902: Flags [P.], seq 4254848:4255068, ack 2341, win 501, length 220
10:01:05.134508 IP lamp-ubuntu-s-1vcpu-1gb-tor1-01.ssh > cpec09435c3be97-cmc09435c3be95.cpe.net.cable.rogers.com.58902: Flags [P.], seq 4255068:4255288, ack 2341, win 501, length 220
10:01:05.134611 IP lamp-ubuntu-s-1vcpu-1gb-tor1-01.ssh > cpec09435c3be97-cmc09435c3be95.cpe.net.cable.rogers.com.58902: Flags [P.], seq 4255288:4255508, ack 2341, win 501, length 220
10:01:05.134715 IP lamp-ubuntu-s-1vcpu-1gb-tor1-01.ssh > cpec09435c3be97-cmc09435c3be95.cpe.net.cable.rogers.com.58902: Flags [P.], seq 4255508:4255728, ack 2341, win 501, length 220
10:01:05.134828 IP lamp-ubuntu-s-1vcpu-1gb-tor1-01.ssh > cpec09435c3be97-cmc09435c3be95.cpe.net.cable.rogers.com.58902: Flags [P.], seq 4255728:4255948, ack 2341, win 501, length 220
10:01:05.134928 IP lamp-ubuntu-s-1vcpu-1gb-tor1-01.ssh > cpec09435c3be97-cmc09435c3be95.cpe.net.cable.rogers.com.58902: Flags [P.], seq 4255948:4256168, ack 2341, win 501, length 220
10:01:05.135015 IP lamp-ubuntu-s-1vcpu-1gb-tor1-01.ssh > cpec09435c3be97-cmc09435c3be95.cpe.net.cable.rogers.com.58902: Flags [P.], seq 4256168:4256388, ack 2341, win 501, length 220
10:01:05.135078 IP lamp-ubuntu-s-1vcpu-1gb-tor1-01.ssh > cpec09435c3be97-cmc09435c3be95.cpe.net.cable.rogers.com.58902: Flags [P.], seq 4256388:4256608, ack 2341, win 501, length 220
10:01:05.135135 IP lamp-ubuntu-s-1vcpu-1gb-tor1-01.ssh > cpec09435c3be97-cmc09435c3be95.cpe.net.cable.rogers.com.58902: Flags [P.], seq 4256608:4256828, ack 2341, win 501, length 220
10:01:05.135189 IP lamp-ubuntu-s-1vcpu-1gb-tor1-01.ssh > cpec09435c3be97-cmc09435c3be95.cpe.net.cable.rogers.com.58902: Flags [P.], seq 4256828:4257048, ack 2341, win 501, length 220
10:01:05.135244 IP lamp-ubuntu-s-1vcpu-1gb-tor1-01.ssh > cpec09435c3be97-cmc09435c3be95.cpe.net.cable.rogers.com.58902: Flags [P.], seq 4257048:4257268, ack 2341, win 501, length 220
10:01:05.135299 IP lamp-ubuntu-s-1vcpu-1gb-tor1-01.ssh > cpec09435c3be97-cmc09435c3be95.cpe.net.cable.rogers.com.58902: Flags [P.], seq 4257268:4257488, ack 2341, win 501, length 220
10:01:05.135351 IP cpec09435c3be97-cmc09435c3be95.cpe.net.cable.rogers.com.58902 > lamp-ubuntu-s-1vcpu-1gb-tor1-01.ssh: Flags [.], ack 4202652, win 1026, length 0
10:01:05.135351 IP cpec09435c3be97-cmc09435c3be95.cpe.net.cable.rogers.com.58902 > lamp-ubuntu-s-1vcpu-1gb-tor1-01.ssh: Flags [.], ack 4203532, win 1023, length 0
10:01:05.135351 IP cpec09435c3be97-cmc09435c3be95.cpe.net.cable.rogers.com.58902 > lamp-ubuntu-s-1vcpu-1gb-tor1-01.ssh: Flags [.], ack 4213872, win 1023, length 0
10:01:05.135415 IP cpec09435c3be97-cmc09435c3be95.cpe.net.cable.rogers.com.58902 > lamp-ubuntu-s-1vcpu-1gb-tor1-01.ssh: Flags [.], ack 4219100, win 1026, length 0
10:01:05.135501 IP lamp-ubuntu-s-1vcpu-1gb-tor1-01.ssh > cpec09435c3be97-cmc09435c3be95.cpe.net.cable.rogers.com.58902: Flags [P.], seq 4257488:4258364, ack 2341, win 501, length 876
10:01:05.135569 IP lamp-ubuntu-s-1vcpu-1gb-tor1-01.ssh > cpec09435c3be97-cmc09435c3be95.cpe.net.cable.rogers.com.58902: Flags [P.], seq 4258364:4258584, ack 2341, win 501, length 220
10:01:05.135718 IP lamp-ubuntu-s-1vcpu-1gb-tor1-01.ssh > cpec09435c3be97-cmc09435c3be95.cpe.net.cable.rogers.com.58902: Flags [P.], seq 4258584:4258804, ack 2341, win 501, length 220
10:01:05.135783 IP lamp-ubuntu-s-1vcpu-1gb-tor1-01.ssh > cpec09435c3be97-cmc09435c3be95.cpe.net.cable.rogers.com.58902: Flags [P.], seq 4258804:4259024, ack 2341, win 501, length 220
10:01:05.135880 IP lamp-ubuntu-s-1vcpu-1gb-tor1-01.ssh > cpec09435c3be97-cmc09435c3be95.cpe.net.cable.rogers.com.58902: Flags [P.], seq 4259024:4259244, ack 2341, win 501, length 220
10:01:05.135960 IP lamp-ubuntu-s-1vcpu-1gb-tor1-01.ssh > cpec09435c3be97-cmc09435c3be95.cpe.net.cable.rogers.com.58902: Flags [P.], seq 4259244:4259464, ack 2341, win 501, length 220
10:01:05.136087 IP lamp-ubuntu-s-1vcpu-1gb-tor1-01.ssh > cpec09435c3be97-cmc09435c3be95.cpe.net.cable.rogers.com.58902: Flags [P.], seq 4259464:4259684, ack 2341, win 501, length 220
10:01:05.136174 IP lamp-ubuntu-s-1vcpu-1gb-tor1-01.ssh > cpec09435c3be97-cmc09435c3be95.cpe.net.cable.rogers.com.58902: Flags [P.], seq 4259684:4259904, ack 2341, win 501, length 220
10:01:05.136235 IP lamp-ubuntu-s-1vcpu-1gb-tor1-01.ssh > cpec09435c3be97-cmc09435c3be95.cpe.net.cable.rogers.com.58902: Flags [P.], seq 4259904:4260124, ack 2341, win 501, length 220
10:01:05.136291 IP lamp-ubuntu-s-1vcpu-1gb-tor1-01.ssh > cpec09435c3be97-cmc09435c3be95.cpe.net.cable.rogers.com.58902: Flags [P.], seq 4260124:4260344, ack 2341, win 501, length 220
10:01:05.136346 IP lamp-ubuntu-s-1vcpu-1gb-tor1-01.ssh > cpec09435c3be97-cmc09435c3be95.cpe.net.cable.rogers.com.58902: Flags [P.], seq 4260344:4260564, ack 2341, win 501, length 220
10:01:05.136421 IP lamp-ubuntu-s-1vcpu-1gb-tor1-01.ssh > cpec09435c3be97-cmc09435c3be95.cpe.net.cable.rogers.com.58902: Flags [P.], seq 4260564:4260784, ack 2341, win 501, length 220
10:01:05.136502 IP lamp-ubuntu-s-1vcpu-1gb-tor1-01.ssh > cpec09435c3be97-cmc09435c3be95.cpe.net.cable.rogers.com.58902: Flags [P.], seq 4260784:4261004, ack 2341, win 501, length 220
10:01:05.136583 IP lamp-ubuntu-s-1vcpu-1gb-tor1-01.ssh > cpec09435c3be97-cmc09435c3be95.cpe.net.cable.rogers.com.58902: Flags [P.], seq 4261004:4261224, ack 2341, win 501, length 220
10:01:05.136673 IP lamp-ubuntu-s-1vcpu-1gb-tor1-01.ssh > cpec09435c3be97-cmc09435c3be95.cpe.net.cable.rogers.com.58902: Flags [P.], seq 4261224:4261444, ack 2341, win 501, length 220
10:01:05.136753 IP lamp-ubuntu-s-1vcpu-1gb-tor1-01.ssh > cpec09435c3be97-cmc09435c3be95.cpe.net.cable.rogers.com.58902: Flags [P.], seq 4261444:4261664, ack 2341, win 501, length 220
10:01:05.136816 IP lamp-ubuntu-s-1vcpu-1gb-tor1-01.ssh > cpec09435c3be97-cmc09435c3be95.cpe.net.cable.rogers.com.58902: Flags [P.], seq 4261664:4261884, ack 2341, win 501, length 220
10:01:05.136898 IP lamp-ubuntu-s-1vcpu-1gb-tor1-01.ssh > cpec09435c3be97-cmc09435c3be95.cpe.net.cable.rogers.com.58902: Flags [P.], seq 4261884:4262104, ack 2341, win 501, length 220
10:01:05.136978 IP lamp-ubuntu-s-1vcpu-1gb-tor1-01.ssh > cpec09435c3be97-cmc09435c3be95.cpe.net.cable.rogers.com.58902: Flags [P.], seq 4262104:4262324, ack 2341, win 501, length 220
10:01:05.137037 IP lamp-ubuntu-s-1vcpu-1gb-tor1-01.ssh > cpec09435c3be97-cmc09435c3be95.cpe.net.cable.rogers.com.58902: Flags [P.], seq 4262324:4262544, ack 2341, win 501, length 220
10:01:05.137094 IP lamp-ubuntu-s-1vcpu-1gb-tor1-01.ssh > cpec09435c3be97-cmc09435c3be95.cpe.net.cable.rogers.com.58902: Flags [P.], seq 4262544:4262764, ack 2341, win 501, length 220
10:01:05.137186 IP lamp-ubuntu-s-1vcpu-1gb-tor1-01.ssh > cpec09435c3be97-cmc09435c3be95.cpe.net.cable.rogers.com.58902: Flags [P.], seq 4262764:4262984, ack 2341, win 501, length 220
10:01:05.137258 IP lamp-ubuntu-s-1vcpu-1gb-tor1-01.ssh > cpec09435c3be97-cmc09435c3be95.cpe.net.cable.rogers.com.58902: Flags [P.], seq 4262984:4263204, ack 2341, win 501, length 220
10:01:05.137321 IP lamp-ubuntu-s-1vcpu-1gb-tor1-01.ssh > cpec09435c3be97-cmc09435c3be95.cpe.net.cable.rogers.com.58902: Flags [P.], seq 4263204:4263424, ack 2341, win 501, length 220
10:01:05.137378 IP lamp-ubuntu-s-1vcpu-1gb-tor1-01.ssh > cpec09435c3be97-cmc09435c3be95.cpe.net.cable.rogers.com.58902: Flags [P.], seq 4263424:4263644, ack 2341, win 501, length 220
10:01:05.137436 IP lamp-ubuntu-s-1vcpu-1gb-tor1-01.ssh > cpec09435c3be97-cmc09435c3be95.cpe.net.cable.rogers.com.58902: Flags [P.], seq 4263644:4263864, ack 2341, win 501, length 220
10:01:05.137493 IP lamp-ubuntu-s-1vcpu-1gb-tor1-01.ssh > cpec09435c3be97-cmc09435c3be95.cpe.net.cable.rogers.com.58902: Flags [P.], seq 4263864:4264084, ack 2341, win 501, length 220
10:01:05.137548 IP lamp-ubuntu-s-1vcpu-1gb-tor1-01.ssh > cpec09435c3be97-cmc09435c3be95.cpe.net.cable.rogers.com.58902: Flags [P.], seq 4264084:4264304, ack 2341, win 501, length 220
10:01:05.137610 IP lamp-ubuntu-s-1vcpu-1gb-tor1-01.ssh > cpec09435c3be97-cmc09435c3be95.cpe.net.cable.rogers.com.58902: Flags [P.], seq 4264304:4264524, ack 2341, win 501, length 220
10:01:05.137665 IP lamp-ubuntu-s-1vcpu-1gb-tor1-01.ssh > cpec09435c3be97-cmc09435c3be95.cpe.net.cable.rogers.com.58902: Flags [P.], seq 4264524:4264744, ack 2341, win 501, length 220
10:01:05.137722 IP lamp-ubuntu-s-1vcpu-1gb-tor1-01.ssh > cpec09435c3be97-cmc09435c3be95.cpe.net.cable.rogers.com.58902: Flags [P.], seq 4264744:4264964, ack 2341, win 501, length 220
10:01:05.137796 IP lamp-ubuntu-s-1vcpu-1gb-tor1-01.ssh > cpec09435c3be97-cmc09435c3be95.cpe.net.cable.rogers.com.58902: Flags [P.], seq 4264964:4265184, ack 2341, win 501, length 220
10:01:05.137876 IP lamp-ubuntu-s-1vcpu-1gb-tor1-01.ssh > cpec09435c3be97-cmc09435c3be95.cpe.net.cable.rogers.com.58902: Flags [P.], seq 4265184:4265404, ack 2341, win 501, length 220
10:01:05.137956 IP lamp-ubuntu-s-1vcpu-1gb-tor1-01.ssh > cpec09435c3be97-cmc09435c3be95.cpe.net.cable.rogers.com.58902: Flags [P.], seq 4265404:4265624, ack 2341, win 501, length 220
10:01:05.138016 IP lamp-ubuntu-s-1vcpu-1gb-tor1-01.ssh > cpec09435c3be97-cmc09435c3be95.cpe.net.cable.rogers.com.58902: Flags [P.], seq 4265624:4265844, ack 2341, win 501, length 220
10:01:05.138073 IP lamp-ubuntu-s-1vcpu-1gb-tor1-01.ssh > cpec09435c3be97-cmc09435c3be95.cpe.net.cable.rogers.com.58902: Flags [P.], seq 4265844:4266064, ack 2341, win 501, length 220
10:01:05.138131 IP lamp-ubuntu-s-1vcpu-1gb-tor1-01.ssh > cpec09435c3be97-cmc09435c3be95.cpe.net.cable.rogers.com.58902: Flags [P.], seq 4266064:4266284, ack 2341, win 501, length 220
10:01:05.138190 IP lamp-ubuntu-s-1vcpu-1gb-tor1-01.ssh > cpec09435c3be97-cmc09435c3be95.cpe.net.cable.rogers.com.58902: Flags [P.], seq 4266284:4266504, ack 2341, win 501, length 220
10:01:05.138245 IP lamp-ubuntu-s-1vcpu-1gb-tor1-01.ssh > cpec09435c3be97-cmc09435c3be95.cpe.net.cable.rogers.com.58902: Flags [P.], seq 4266504:4266724, ack 2341, win 501, length 220
10:01:05.138302 IP lamp-ubuntu-s-1vcpu-1gb-tor1-01.ssh > cpec09435c3be97-cmc09435c3be95.cpe.net.cable.rogers.com.58902: Flags [P.], seq 4266724:4266944, ack 2341, win 501, length 220
10:01:05.138358 IP lamp-ubuntu-s-1vcpu-1gb-tor1-01.ssh > cpec09435c3be97-cmc09435c3be95.cpe.net.cable.rogers.com.58902: Flags [P.], seq 4266944:4267164, ack 2341, win 501, length 220
10:01:05.138420 IP lamp-ubuntu-s-1vcpu-1gb-tor1-01.ssh > cpec09435c3be97-cmc09435c3be95.cpe.net.cable.rogers.com.58902: Flags [P.], seq 4267164:4267384, ack 2341, win 501, length 220
10:01:05.138478 IP lamp-ubuntu-s-1vcpu-1gb-tor1-01.ssh > cpec09435c3be97-cmc09435c3be95.cpe.net.cable.rogers.com.58902: Flags [P.], seq 4267384:4267604, ack 2341, win 501, length 220
10:01:05.138568 IP lamp-ubuntu-s-1vcpu-1gb-tor1-01.ssh > cpec09435c3be97-cmc09435c3be95.cpe.net.cable.rogers.com.58902: Flags [P.], seq 4267604:4267824, ack 2341, win 501, length 220
10:01:05.138657 IP lamp-ubuntu-s-1vcpu-1gb-tor1-01.ssh > cpec09435c3be97-cmc09435c3be95.cpe.net.cable.rogers.com.58902: Flags [P.], seq 4267824:4268044, ack 2341, win 501, length 220
10:01:05.138759 IP lamp-ubuntu-s-1vcpu-1gb-tor1-01.ssh > cpec09435c3be97-cmc09435c3be95.cpe.net.cable.rogers.com.58902: Flags [P.], seq 4268044:4268264, ack 2341, win 501, length 220
10:01:05.138820 IP lamp-ubuntu-s-1vcpu-1gb-tor1-01.ssh > cpec09435c3be97-cmc09435c3be95.cpe.net.cable.rogers.com.58902: Flags [P.], seq 4268264:4268484, ack 2341, win 501, length 220
10:01:05.138878 IP lamp-ubuntu-s-1vcpu-1gb-tor1-01.ssh > cpec09435c3be97-cmc09435c3be95.cpe.net.cable.rogers.com.58902: Flags [P.], seq 4268484:4268704, ack 2341, win 501, length 220
10:01:05.138938 IP lamp-ubuntu-s-1vcpu-1gb-tor1-01.ssh > cpec09435c3be97-cmc09435c3be95.cpe.net.cable.rogers.com.58902: Flags [P.], seq 4268704:4268924, ack 2341, win 501, length 220
10:01:05.139027 IP lamp-ubuntu-s-1vcpu-1gb-tor1-01.ssh > cpec09435c3be97-cmc09435c3be95.cpe.net.cable.rogers.com.58902: Flags [P.], seq 4268924:4269144, ack 2341, win 501, length 220
10:01:05.139121 IP lamp-ubuntu-s-1vcpu-1gb-tor1-01.ssh > cpec09435c3be97-cmc09435c3be95.cpe.net.cable.rogers.com.58902: Flags [P.], seq 4269144:4269364, ack 2341, win 501, length 220
10:01:05.139225 IP lamp-ubuntu-s-1vcpu-1gb-tor1-01.ssh > cpec09435c3be97-cmc09435c3be95.cpe.net.cable.rogers.com.58902: Flags [P.], seq 4269364:4269584, ack 2341, win 501, length 220
10:01:05.139301 IP lamp-ubuntu-s-1vcpu-1gb-tor1-01.ssh > cpec09435c3be97-cmc09435c3be95.cpe.net.cable.rogers.com.58902: Flags [P.], seq 4269584:4269804, ack 2341, win 501, length 220
10:01:05.139368 IP lamp-ubuntu-s-1vcpu-1gb-tor1-01.ssh > cpec09435c3be97-cmc09435c3be95.cpe.net.cable.rogers.com.58902: Flags [P.], seq 4269804:4270024, ack 2341, win 501, length 220
10:01:05.139425 IP lamp-ubuntu-s-1vcpu-1gb-tor1-01.ssh > cpec09435c3be97-cmc09435c3be95.cpe.net.cable.rogers.com.58902: Flags [P.], seq 4270024:4270244, ack 2341, win 501, length 220
10:01:05.139490 IP lamp-ubuntu-s-1vcpu-1gb-tor1-01.ssh > cpec09435c3be97-cmc09435c3be95.cpe.net.cable.rogers.com.58902: Flags [P.], seq 4270244:4270464, ack 2341, win 501, length 220
10:01:05.139548 IP lamp-ubuntu-s-1vcpu-1gb-tor1-01.ssh > cpec09435c3be97-cmc09435c3be95.cpe.net.cable.rogers.com.58902: Flags [P.], seq 4270464:4270684, ack 2341, win 501, length 220
10:01:05.139608 IP lamp-ubuntu-s-1vcpu-1gb-tor1-01.ssh > cpec09435c3be97-cmc09435c3be95.cpe.net.cable.rogers.com.58902: Flags [P.], seq 4270684:4270904, ack 2341, win 501, length 220
10:01:05.139667 IP lamp-ubuntu-s-1vcpu-1gb-tor1-01.ssh > cpec09435c3be97-cmc09435c3be95.cpe.net.cable.rogers.com.58902: Flags [P.], seq 4270904:4271124, ack 2341, win 501, length 220
10:01:05.139729 IP lamp-ubuntu-s-1vcpu-1gb-tor1-01.ssh > cpec09435c3be97-cmc09435c3be95.cpe.net.cable.rogers.com.58902: Flags [P.], seq 4271124:4271344, ack 2341, win 501, length 220
10:01:05.139800 IP lamp-ubuntu-s-1vcpu-1gb-tor1-01.ssh > cpec09435c3be97-cmc09435c3be95.cpe.net.cable.rogers.com.58902: Flags [P.], seq 4271344:4271564, ack 2341, win 501, length 220
10:01:05.139879 IP lamp-ubuntu-s-1vcpu-1gb-tor1-01.ssh > cpec09435c3be97-cmc09435c3be95.cpe.net.cable.rogers.com.58902: Flags [P.], seq 4271564:4271784, ack 2341, win 501, length 220
10:01:05.139968 IP lamp-ubuntu-s-1vcpu-1gb-tor1-01.ssh > cpec09435c3be97-cmc09435c3be95.cpe.net.cable.rogers.com.58902: Flags [P.], seq 4271784:4272004, ack 2341, win 501, length 220
10:01:05.140077 IP lamp-ubuntu-s-1vcpu-1gb-tor1-01.ssh > cpec09435c3be97-cmc09435c3be95.cpe.net.cable.rogers.com.58902: Flags [P.], seq 4272004:4272224, ack 2341, win 501, length 220
10:01:05.140174 IP lamp-ubuntu-s-1vcpu-1gb-tor1-01.ssh > cpec09435c3be97-cmc09435c3be95.cpe.net.cable.rogers.com.58902: Flags [P.], seq 4272224:4272444, ack 2341, win 501, length 220
10:01:05.140239 IP lamp-ubuntu-s-1vcpu-1gb-tor1-01.ssh > cpec09435c3be97-cmc09435c3be95.cpe.net.cable.rogers.com.58902: Flags [P.], seq 4272444:4272664, ack 2341, win 501, length 220
10:01:05.140297 IP lamp-ubuntu-s-1vcpu-1gb-tor1-01.ssh > cpec09435c3be97-cmc09435c3be95.cpe.net.cable.rogers.com.58902: Flags [P.], seq 4272664:4272884, ack 2341, win 501, length 220
10:01:05.140354 IP lamp-ubuntu-s-1vcpu-1gb-tor1-01.ssh > cpec09435c3be97-cmc09435c3be95.cpe.net.cable.rogers.com.58902: Flags [P.], seq 4272884:4273104, ack 2341, win 501, length 220
10:01:05.140409 IP lamp-ubuntu-s-1vcpu-1gb-tor1-01.ssh > cpec09435c3be97-cmc09435c3be95.cpe.net.cable.rogers.com.58902: Flags [P.], seq 4273104:4273324, ack 2341, win 501, length 220
10:01:05.140463 IP lamp-ubuntu-s-1vcpu-1gb-tor1-01.ssh > cpec09435c3be97-cmc09435c3be95.cpe.net.cable.rogers.com.58902: Flags [P.], seq 4273324:4273544, ack 2341, win 501, length 220
10:01:05.140522 IP lamp-ubuntu-s-1vcpu-1gb-tor1-01.ssh > cpec09435c3be97-cmc09435c3be95.cpe.net.cable.rogers.com.58902: Flags [P.], seq 4273544:4273764, ack 2341, win 501, length 220
10:01:05.140579 IP lamp-ubuntu-s-1vcpu-1gb-tor1-01.ssh > cpec09435c3be97-cmc09435c3be95.cpe.net.cable.rogers.com.58902: Flags [P.], seq 4273764:4273984, ack 2341, win 501, length 220
10:01:05.140635 IP lamp-ubuntu-s-1vcpu-1gb-tor1-01.ssh > cpec09435c3be97-cmc09435c3be95.cpe.net.cable.rogers.com.58902: Flags [P.], seq 4273984:4274204, ack 2341, win 501, length 220
10:01:05.140692 IP lamp-ubuntu-s-1vcpu-1gb-tor1-01.ssh > cpec09435c3be97-cmc09435c3be95.cpe.net.cable.rogers.com.58902: Flags [P.], seq 4274204:4274424, ack 2341, win 501, length 220
10:01:05.140747 IP lamp-ubuntu-s-1vcpu-1gb-tor1-01.ssh > cpec09435c3be97-cmc09435c3be95.cpe.net.cable.rogers.com.58902: Flags [P.], seq 4274424:4274644, ack 2341, win 501, length 220
10:01:05.140848 IP lamp-ubuntu-s-1vcpu-1gb-tor1-01.ssh > cpec09435c3be97-cmc09435c3be95.cpe.net.cable.rogers.com.58902: Flags [P.], seq 4274644:4274864, ack 2341, win 501, length 220
10:01:05.140952 IP lamp-ubuntu-s-1vcpu-1gb-tor1-01.ssh > cpec09435c3be97-cmc09435c3be95.cpe.net.cable.rogers.com.58902: Flags [P.], seq 4274864:4275084, ack 2341, win 501, length 220
10:01:05.141025 IP lamp-ubuntu-s-1vcpu-1gb-tor1-01.ssh > cpec09435c3be97-cmc09435c3be95.cpe.net.cable.rogers.com.58902: Flags [P.], seq 4275084:4275304, ack 2341, win 501, length 220
10:01:05.141084 IP lamp-ubuntu-s-1vcpu-1gb-tor1-01.ssh > cpec09435c3be97-cmc09435c3be95.cpe.net.cable.rogers.com.58902: Flags [P.], seq 4275304:4275524, ack 2341, win 501, length 220
10:01:05.141144 IP lamp-ubuntu-s-1vcpu-1gb-tor1-01.ssh > cpec09435c3be97-cmc09435c3be95.cpe.net.cable.rogers.com.58902: Flags [P.], seq 4275524:4275744, ack 2341, win 501, length 220
10:01:05.141202 IP lamp-ubuntu-s-1vcpu-1gb-tor1-01.ssh > cpec09435c3be97-cmc09435c3be95.cpe.net.cable.rogers.com.58902: Flags [P.], seq 4275744:4275964, ack 2341, win 501, length 220
10:01:05.141262 IP lamp-ubuntu-s-1vcpu-1gb-tor1-01.ssh > cpec09435c3be97-cmc09435c3be95.cpe.net.cable.rogers.com.58902: Flags [P.], seq 4275964:4276184, ack 2341, win 501, length 220
10:01:05.141317 IP lamp-ubuntu-s-1vcpu-1gb-tor1-01.ssh > cpec09435c3be97-cmc09435c3be95.cpe.net.cable.rogers.com.58902: Flags [P.], seq 4276184:4276404, ack 2341, win 501, length 220
10:01:05.141372 IP lamp-ubuntu-s-1vcpu-1gb-tor1-01.ssh > cpec09435c3be97-cmc09435c3be95.cpe.net.cable.rogers.com.58902: Flags [P.], seq 4276404:4276624, ack 2341, win 501, length 220
10:01:05.141422 IP cpec09435c3be97-cmc09435c3be95.cpe.net.cable.rogers.com.58902 > lamp-ubuntu-s-1vcpu-1gb-tor1-01.ssh: Flags [.], ack 4222400, win 1026, length 0
10:01:05.141422 IP cpec09435c3be97-cmc09435c3be95.cpe.net.cable.rogers.com.58902 > lamp-ubuntu-s-1vcpu-1gb-tor1-01.ssh: Flags [P.], seq 2341:2377, ack 4222400, win 1026, length 36
10:01:05.141423 IP cpec09435c3be97-cmc09435c3be95.cpe.net.cable.rogers.com.58902 > lamp-ubuntu-s-1vcpu-1gb-tor1-01.ssh: Flags [.], ack 4228340, win 1026, length 0
10:01:05.141492 IP cpec09435c3be97-cmc09435c3be95.cpe.net.cable.rogers.com.58902 > lamp-ubuntu-s-1vcpu-1gb-tor1-01.ssh: Flags [.], ack 4234500, win 1026, length 0
10:01:05.141492 IP cpec09435c3be97-cmc09435c3be95.cpe.net.cable.rogers.com.58902 > lamp-ubuntu-s-1vcpu-1gb-tor1-01.ssh: Flags [.], ack 4237908, win 1026, length 0
10:01:05.141492 IP cpec09435c3be97-cmc09435c3be95.cpe.net.cable.rogers.com.58902 > lamp-ubuntu-s-1vcpu-1gb-tor1-01.ssh: Flags [.], ack 4244068, win 1026, length 0
10:01:05.141692 IP lamp-ubuntu-s-1vcpu-1gb-tor1-01.ssh > cpec09435c3be97-cmc09435c3be95.cpe.net.cable.rogers.com.58902: Flags [P.], seq 4276624:4277844, ack 2377, win 501, length 1220
10:01:05.141855 IP lamp-ubuntu-s-1vcpu-1gb-tor1-01.ssh > cpec09435c3be97-cmc09435c3be95.cpe.net.cable.rogers.com.58902: Flags [P.], seq 4277844:4278064, ack 2377, win 501, length 220
10:01:05.141963 IP lamp-ubuntu-s-1vcpu-1gb-tor1-01.ssh > cpec09435c3be97-cmc09435c3be95.cpe.net.cable.rogers.com.58902: Flags [P.], seq 4278064:4278284, ack 2377, win 501, length 220
10:01:05.142051 IP lamp-ubuntu-s-1vcpu-1gb-tor1-01.ssh > cpec09435c3be97-cmc09435c3be95.cpe.net.cable.rogers.com.58902: Flags [P.], seq 4278284:4278504, ack 2377, win 501, length 220
10:01:05.142140 IP lamp-ubuntu-s-1vcpu-1gb-tor1-01.ssh > cpec09435c3be97-cmc09435c3be95.cpe.net.cable.rogers.com.58902: Flags [P.], seq 4278504:4278724, ack 2377, win 501, length 220
10:01:05.142224 IP lamp-ubuntu-s-1vcpu-1gb-tor1-01.ssh > cpec09435c3be97-cmc09435c3be95.cpe.net.cable.rogers.com.58902: Flags [P.], seq 4278724:4278944, ack 2377, win 501, length 220
10:01:05.142312 IP lamp-ubuntu-s-1vcpu-1gb-tor1-01.ssh > cpec09435c3be97-cmc09435c3be95.cpe.net.cable.rogers.com.58902: Flags [P.], seq 4278944:4279164, ack 2377, win 501, length 220
10:01:05.142384 IP lamp-ubuntu-s-1vcpu-1gb-tor1-01.ssh > cpec09435c3be97-cmc09435c3be95.cpe.net.cable.rogers.com.58902: Flags [P.], seq 4279164:4279384, ack 2377, win 501, length 220
10:01:05.142445 IP lamp-ubuntu-s-1vcpu-1gb-tor1-01.ssh > cpec09435c3be97-cmc09435c3be95.cpe.net.cable.rogers.com.58902: Flags [P.], seq 4279384:4279604, ack 2377, win 501, length 220
10:01:05.142510 IP lamp-ubuntu-s-1vcpu-1gb-tor1-01.ssh > cpec09435c3be97-cmc09435c3be95.cpe.net.cable.rogers.com.58902: Flags [P.], seq 4279604:4279824, ack 2377, win 501, length 220
10:01:05.142570 IP lamp-ubuntu-s-1vcpu-1gb-tor1-01.ssh > cpec09435c3be97-cmc09435c3be95.cpe.net.cable.rogers.com.58902: Flags [P.], seq 4279824:4280044, ack 2377, win 501, length 220
10:01:05.142628 IP lamp-ubuntu-s-1vcpu-1gb-tor1-01.ssh > cpec09435c3be97-cmc09435c3be95.cpe.net.cable.rogers.com.58902: Flags [P.], seq 4280044:4280264, ack 2377, win 501, length 220
10:01:05.142687 IP lamp-ubuntu-s-1vcpu-1gb-tor1-01.ssh > cpec09435c3be97-cmc09435c3be95.cpe.net.cable.rogers.com.58902: Flags [P.], seq 4280264:4280484, ack 2377, win 501, length 220
10:01:05.142763 IP lamp-ubuntu-s-1vcpu-1gb-tor1-01.ssh > cpec09435c3be97-cmc09435c3be95.cpe.net.cable.rogers.com.58902: Flags [P.], seq 4280484:4280704, ack 2377, win 501, length 220
10:01:05.142907 IP lamp-ubuntu-s-1vcpu-1gb-tor1-01.ssh > cpec09435c3be97-cmc09435c3be95.cpe.net.cable.rogers.com.58902: Flags [P.], seq 4280704:4280924, ack 2377, win 501, length 220
10:01:05.142986 IP lamp-ubuntu-s-1vcpu-1gb-tor1-01.ssh > cpec09435c3be97-cmc09435c3be95.cpe.net.cable.rogers.com.58902: Flags [P.], seq 4280924:4281144, ack 2377, win 501, length 220
10:01:05.143051 IP lamp-ubuntu-s-1vcpu-1gb-tor1-01.ssh > cpec09435c3be97-cmc09435c3be95.cpe.net.cable.rogers.com.58902: Flags [P.], seq 4281144:4281364, ack 2377, win 501, length 220
10:01:05.143109 IP lamp-ubuntu-s-1vcpu-1gb-tor1-01.ssh > cpec09435c3be97-cmc09435c3be95.cpe.net.cable.rogers.com.58902: Flags [P.], seq 4281364:4281584, ack 2377, win 501, length 220
10:01:05.143168 IP lamp-ubuntu-s-1vcpu-1gb-tor1-01.ssh > cpec09435c3be97-cmc09435c3be95.cpe.net.cable.rogers.com.58902: Flags [P.], seq 4281584:4281804, ack 2377, win 501, length 220
10:01:05.143228 IP lamp-ubuntu-s-1vcpu-1gb-tor1-01.ssh > cpec09435c3be97-cmc09435c3be95.cpe.net.cable.rogers.com.58902: Flags [P.], seq 4281804:4282024, ack 2377, win 501, length 220
10:01:05.143282 IP lamp-ubuntu-s-1vcpu-1gb-tor1-01.ssh > cpec09435c3be97-cmc09435c3be95.cpe.net.cable.rogers.com.58902: Flags [P.], seq 4282024:4282244, ack 2377, win 501, length 220
10:01:05.143338 IP lamp-ubuntu-s-1vcpu-1gb-tor1-01.ssh > cpec09435c3be97-cmc09435c3be95.cpe.net.cable.rogers.com.58902: Flags [P.], seq 4282244:4282464, ack 2377, win 501, length 220
10:01:05.143393 IP lamp-ubuntu-s-1vcpu-1gb-tor1-01.ssh > cpec09435c3be97-cmc09435c3be95.cpe.net.cable.rogers.com.58902: Flags [P.], seq 4282464:4282684, ack 2377, win 501, length 220
10:01:05.143450 IP lamp-ubuntu-s-1vcpu-1gb-tor1-01.ssh > cpec09435c3be97-cmc09435c3be95.cpe.net.cable.rogers.com.58902: Flags [P.], seq 4282684:4282904, ack 2377, win 501, length 220
10:01:05.143505 IP lamp-ubuntu-s-1vcpu-1gb-tor1-01.ssh > cpec09435c3be97-cmc09435c3be95.cpe.net.cable.rogers.com.58902: Flags [P.], seq 4282904:4283124, ack 2377, win 501, length 220
10:01:05.143561 IP lamp-ubuntu-s-1vcpu-1gb-tor1-01.ssh > cpec09435c3be97-cmc09435c3be95.cpe.net.cable.rogers.com.58902: Flags [P.], seq 4283124:4283344, ack 2377, win 501, length 220
10:01:05.143618 IP lamp-ubuntu-s-1vcpu-1gb-tor1-01.ssh > cpec09435c3be97-cmc09435c3be95.cpe.net.cable.rogers.com.58902: Flags [P.], seq 4283344:4283564, ack 2377, win 501, length 220
10:01:05.143676 IP lamp-ubuntu-s-1vcpu-1gb-tor1-01.ssh > cpec09435c3be97-cmc09435c3be95.cpe.net.cable.rogers.com.58902: Flags [P.], seq 4283564:4283784, ack 2377, win 501, length 220
10:01:05.143733 IP lamp-ubuntu-s-1vcpu-1gb-tor1-01.ssh > cpec09435c3be97-cmc09435c3be95.cpe.net.cable.rogers.com.58902: Flags [P.], seq 4283784:4284004, ack 2377, win 501, length 220
10:01:05.143747 IP cpec09435c3be97-cmc09435c3be95.cpe.net.cable.rogers.com.58902 > lamp-ubuntu-s-1vcpu-1gb-tor1-01.ssh: Flags [.], ack 4247368, win 1026, length 0
10:01:05.143747 IP cpec09435c3be97-cmc09435c3be95.cpe.net.cable.rogers.com.58902 > lamp-ubuntu-s-1vcpu-1gb-tor1-01.ssh: Flags [.], ack 4252648, win 1026, length 0
10:01:05.143795 IP cpec09435c3be97-cmc09435c3be95.cpe.net.cable.rogers.com.58902 > lamp-ubuntu-s-1vcpu-1gb-tor1-01.ssh: Flags [P.], seq 2377:2413, ack 4252648, win 1026, length 36
