09:58:45.524462 IP 159.203.62.249.22 > 99.238.40.163.58902: Flags [P.], seq 3502580:3502744, ack 1873, win 501, length 164
09:58:45.524595 IP 159.203.62.249.22 > 99.238.40.163.58902: Flags [P.], seq 3502744:3502908, ack 1873, win 501, length 164
09:58:45.524729 IP 159.203.62.249.22 > 99.238.40.163.58902: Flags [P.], seq 3502908:3503072, ack 1873, win 501, length 164
09:58:45.524838 IP 159.203.62.249.22 > 99.238.40.163.58902: Flags [P.], seq 3503072:3503236, ack 1873, win 501, length 164
09:58:45.525077 IP 159.203.62.249.22 > 99.238.40.163.58902: Flags [P.], seq 3503236:3503400, ack 1873, win 501, length 164
09:58:45.525189 IP 159.203.62.249.22 > 99.238.40.163.58902: Flags [P.], seq 3503400:3503564, ack 1873, win 501, length 164
09:58:45.525299 IP 159.203.62.249.22 > 99.238.40.163.58902: Flags [P.], seq 3503564:3503728, ack 1873, win 501, length 164
09:58:45.525430 IP 159.203.62.249.22 > 99.238.40.163.58902: Flags [P.], seq 3503728:3503892, ack 1873, win 501, length 164
09:58:45.525547 IP 159.203.62.249.22 > 99.238.40.163.58902: Flags [P.], seq 3503892:3504056, ack 1873, win 501, length 164
09:58:45.525655 IP 159.203.62.249.22 > 99.238.40.163.58902: Flags [P.], seq 3504056:3504220, ack 1873, win 501, length 164
09:58:45.525794 IP 159.203.62.249.22 > 99.238.40.163.58902: Flags [P.], seq 3504220:3504384, ack 1873, win 501, length 164
09:58:45.526061 IP 159.203.62.249.22 > 99.238.40.163.58902: Flags [P.], seq 3504384:3504548, ack 1873, win 501, length 164
09:58:45.526171 IP 159.203.62.249.22 > 99.238.40.163.58902: Flags [P.], seq 3504548:3504712, ack 1873, win 501, length 164
09:58:45.526277 IP 159.203.62.249.22 > 99.238.40.163.58902: Flags [P.], seq 3504712:3504876, ack 1873, win 501, length 164
09:58:45.526391 IP 159.203.62.249.22 > 99.238.40.163.58902: Flags [P.], seq 3504876:3505040, ack 1873, win 501, length 164
09:58:45.526518 IP 159.203.62.249.22 > 99.238.40.163.58902: Flags [P.], seq 3505040:3505204, ack 1873, win 501, length 164
09:58:45.526624 IP 159.203.62.249.22 > 99.238.40.163.58902: Flags [P.], seq 3505204:3505368, ack 1873, win 501, length 164
09:58:45.526732 IP 159.203.62.249.22 > 99.238.40.163.58902: Flags [P.], seq 3505368:3505532, ack 1873, win 501, length 164
09:58:45.526839 IP 159.203.62.249.22 > 99.238.40.163.58902: Flags [P.], seq 3505532:3505696, ack 1873, win 501, length 164
09:58:45.526935 IP 159.203.62.249.22 > 99.238.40.163.58902: Flags [P.], seq 3505696:3505860, ack 1873, win 501, length 164
09:58:45.527049 IP 159.203.62.249.22 > 99.238.40.163.58902: Flags [P.], seq 3505860:3506024, ack 1873, win 501, length 164
09:58:45.527224 IP 159.203.62.249.22 > 99.238.40.163.58902: Flags [P.], seq 3506024:3506188, ack 1873, win 501, length 164
09:58:45.527333 IP 159.203.62.249.22 > 99.238.40.163.58902: Flags [P.], seq 3506188:3506352, ack 1873, win 501, length 164
09:58:45.527445 IP 159.203.62.249.22 > 99.238.40.163.58902: Flags [P.], seq 3506352:3506516, ack 1873, win 501, length 164
09:58:45.527547 IP 159.203.62.249.22 > 99.238.40.163.58902: Flags [P.], seq 3506516:3506680, ack 1873, win 501, length 164
09:58:45.527651 IP 159.203.62.249.22 > 99.238.40.163.58902: Flags [P.], seq 3506680:3506844, ack 1873, win 501, length 164
09:58:45.527763 IP 159.203.62.249.22 > 99.238.40.163.58902: Flags [P.], seq 3506844:3507008, ack 1873, win 501, length 164
09:58:45.527879 IP 159.203.62.249.22 > 99.238.40.163.58902: Flags [P.], seq 3507008:3507172, ack 1873, win 501, length 164
09:58:45.527986 IP 159.203.62.249.22 > 99.238.40.163.58902: Flags [P.], seq 3507172:3507336, ack 1873, win 501, length 164
09:58:45.528100 IP 159.203.62.249.22 > 99.238.40.163.58902: Flags [P.], seq 3507336:3507500, ack 1873, win 501, length 164
09:58:45.528205 IP 159.203.62.249.22 > 99.238.40.163.58902: Flags [P.], seq 3507500:3507664, ack 1873, win 501, length 164
09:58:45.528330 IP 159.203.62.249.22 > 99.238.40.163.58902: Flags [P.], seq 3507664:3507828, ack 1873, win 501, length 164
09:58:45.528444 IP 159.203.62.249.22 > 99.238.40.163.58902: Flags [P.], seq 3507828:3507992, ack 1873, win 501, length 164
09:58:45.528551 IP 159.203.62.249.22 > 99.238.40.163.58902: Flags [P.], seq 3507992:3508156, ack 1873, win 501, length 164
09:58:45.528656 IP 159.203.62.249.22 > 99.238.40.163.58902: Flags [P.], seq 3508156:3508320, ack 1873, win 501, length 164
09:58:45.528786 IP 159.203.62.249.22 > 99.238.40.163.58902: Flags [P.], seq 3508320:3508484, ack 1873, win 501, length 164
09:58:45.528901 IP 159.203.62.249.22 > 99.238.40.163.58902: Flags [P.], seq 3508484:3508648, ack 1873, win 501, length 164
09:58:45.529028 IP 159.203.62.249.22 > 99.238.40.163.58902: Flags [P.], seq 3508648:3508812, ack 1873, win 501, length 164
09:58:45.529139 IP 159.203.62.249.22 > 99.238.40.163.58902: Flags [P.], seq 3508812:3508976, ack 1873, win 501, length 164
09:58:45.529243 IP 159.203.62.249.22 > 99.238.40.163.58902: Flags [P.], seq 3508976:3509140, ack 1873, win 501, length 164
09:58:45.529359 IP 159.203.62.249.22 > 99.238.40.163.58902: Flags [P.], seq 3509140:3509304, ack 1873, win 501, length 164
09:58:45.529481 IP 159.203.62.249.22 > 99.238.40.163.58902: Flags [P.], seq 3509304:3509468, ack 1873, win 501, length 164
09:58:45.529594 IP 159.203.62.249.22 > 99.238.40.163.58902: Flags [P.], seq 3509468:3509632, ack 1873, win 501, length 164
09:58:45.529719 IP 159.203.62.249.22 > 99.238.40.163.58902: Flags [P.], seq 3509632:3509796, ack 1873, win 501, length 164
09:58:45.530262 IP 159.203.62.249.22 > 99.238.40.163.58902: Flags [P.], seq 3509796:3509960, ack 1873, win 501, length 164
09:58:45.530392 IP 159.203.62.249.22 > 99.238.40.163.58902: Flags [P.], seq 3509960:3510124, ack 1873, win 501, length 164
09:58:45.530532 IP 159.203.62.249.22 > 99.238.40.163.58902: Flags [P.], seq 3510124:3510288, ack 1873, win 501, length 164
09:58:45.530661 IP 159.203.62.249.22 > 99.238.40.163.58902: Flags [P.], seq 3510288:3510452, ack 1873, win 501, length 164
09:58:45.530779 IP 159.203.62.249.22 > 99.238.40.163.58902: Flags [P.], seq 3510452:3510616, ack 1873, win 501, length 164
09:58:45.530889 IP 159.203.62.249.22 > 99.238.40.163.58902: Flags [P.], seq 3510616:3510780, ack 1873, win 501, length 164
09:58:45.531206 IP 99.238.40.163.58902 > 159.203.62.249.22: Flags [.], ack 3486704, win 1023, length 0
09:58:45.531302 IP 99.238.40.163.58902 > 159.203.62.249.22: Flags [.], ack 3489656, win 1026, length 0
09:58:45.531302 IP 99.238.40.163.58902 > 159.203.62.249.22: Flags [.], ack 3490312, win 1024, length 0
09:58:45.531302 IP 99.238.40.163.58902 > 159.203.62.249.22: Flags [.], ack 3491952, win 1026, length 0
09:58:45.531473 IP 159.203.62.249.22 > 99.238.40.163.58902: Flags [P.], seq 3510780:3510944, ack 1873, win 501, length 164
09:58:45.531585 IP 159.203.62.249.22 > 99.238.40.163.58902: Flags [P.], seq 3510944:3511396, ack 1873, win 501, length 452
09:58:45.531702 IP 159.203.62.249.22 > 99.238.40.163.58902: Flags [P.], seq 3511396:3511560, ack 1873, win 501, length 164
09:58:45.531812 IP 159.203.62.249.22 > 99.238.40.163.58902: Flags [P.], seq 3511560:3511724, ack 1873, win 501, length 164
09:58:45.531927 IP 159.203.62.249.22 > 99.238.40.163.58902: Flags [P.], seq 3511724:3511888, ack 1873, win 501, length 164
09:58:45.532212 IP 159.203.62.249.22 > 99.238.40.163.58902: Flags [P.], seq 3511888:3512052, ack 1873, win 501, length 164
09:58:45.532266 IP 159.203.62.249.22 > 99.238.40.163.58902: Flags [P.], seq 3512052:3512216, ack 1873, win 501, length 164
09:58:45.532407 IP 159.203.62.249.22 > 99.238.40.163.58902: Flags [P.], seq 3512216:3512500, ack 1873, win 501, length 284
09:58:45.532631 IP 159.203.62.249.22 > 99.238.40.163.58902: Flags [P.], seq 3512500:3512664, ack 1873, win 501, length 164
09:58:45.532941 IP 159.203.62.249.22 > 99.238.40.163.58902: Flags [P.], seq 3512664:3512828, ack 1873, win 501, length 164
09:58:45.533060 IP 159.203.62.249.22 > 99.238.40.163.58902: Flags [P.], seq 3512828:3512992, ack 1873, win 501, length 164
09:58:45.533166 IP 159.203.62.249.22 > 99.238.40.163.58902: Flags [P.], seq 3512992:3513156, ack 1873, win 501, length 164
09:58:45.533269 IP 159.203.62.249.22 > 99.238.40.163.58902: Flags [P.], seq 3513156:3513320, ack 1873, win 501, length 164
09:58:45.533377 IP 159.203.62.249.22 > 99.238.40.163.58902: Flags [P.], seq 3513320:3513484, ack 1873, win 501, length 164
09:58:45.533479 IP 159.203.62.249.22 > 99.238.40.163.58902: Flags [P.], seq 3513484:3513648, ack 1873, win 501, length 164
09:58:45.533581 IP 159.203.62.249.22 > 99.238.40.163.58902: Flags [P.], seq 3513648:3513812, ack 1873, win 501, length 164
09:58:45.533686 IP 159.203.62.249.22 > 99.238.40.163.58902: Flags [P.], seq 3513812:3513976, ack 1873, win 501, length 164
09:58:45.533813 IP 159.203.62.249.22 > 99.238.40.163.58902: Flags [P.], seq 3513976:3514140, ack 1873, win 501, length 164
09:58:45.533931 IP 159.203.62.249.22 > 99.238.40.163.58902: Flags [P.], seq 3514140:3514304, ack 1873, win 501, length 164
09:58:45.534032 IP 159.203.62.249.22 > 99.238.40.163.58902: Flags [P.], seq 3514304:3514468, ack 1873, win 501, length 164
09:58:45.534138 IP 159.203.62.249.22 > 99.238.40.163.58902: Flags [P.], seq 3514468:3514632, ack 1873, win 501, length 164
09:58:45.534371 IP 159.203.62.249.22 > 99.238.40.163.58902: Flags [P.], seq 3514632:3514796, ack 1873, win 501, length 164
09:58:45.534490 IP 159.203.62.249.22 > 99.238.40.163.58902: Flags [P.], seq 3514796:3514960, ack 1873, win 501, length 164
09:58:45.534625 IP 159.203.62.249.22 > 99.238.40.163.58902: Flags [P.], seq 3514960:3515124, ack 1873, win 501, length 164
09:58:45.534743 IP 159.203.62.249.22 > 99.238.40.163.58902: Flags [P.], seq 3515124:3515288, ack 1873, win 501, length 164
09:58:45.534861 IP 159.203.62.249.22 > 99.238.40.163.58902: Flags [P.], seq 3515288:3515452, ack 1873, win 501, length 164
09:58:45.534971 IP 159.203.62.249.22 > 99.238.40.163.58902: Flags [P.], seq 3515452:3515616, ack 1873, win 501, length 164
09:58:45.535096 IP 159.203.62.249.22 > 99.238.40.163.58902: Flags [P.], seq 3515616:3515780, ack 1873, win 501, length 164
09:58:45.535215 IP 159.203.62.249.22 > 99.238.40.163.58902: Flags [P.], seq 3515780:3515944, ack 1873, win 501, length 164
09:58:45.535337 IP 159.203.62.249.22 > 99.238.40.163.58902: Flags [P.], seq 3515944:3516108, ack 1873, win 501, length 164
09:58:45.535457 IP 159.203.62.249.22 > 99.238.40.163.58902: Flags [P.], seq 3516108:3516272, ack 1873, win 501, length 164
09:58:45.535564 IP 159.203.62.249.22 > 99.238.40.163.58902: Flags [P.], seq 3516272:3516436, ack 1873, win 501, length 164
09:58:45.535798 IP 159.203.62.249.22 > 99.238.40.163.58902: Flags [P.], seq 3516436:3516600, ack 1873, win 501, length 164
09:58:45.536018 IP 159.203.62.249.22 > 99.238.40.163.58902: Flags [P.], seq 3516600:3516764, ack 1873, win 501, length 164
09:58:45.536134 IP 159.203.62.249.22 > 99.238.40.163.58902: Flags [P.], seq 3516764:3516928, ack 1873, win 501, length 164
09:58:45.536243 IP 159.203.62.249.22 > 99.238.40.163.58902: Flags [P.], seq 3516928:3517092, ack 1873, win 501, length 164
09:58:45.536364 IP 159.203.62.249.22 > 99.238.40.163.58902: Flags [P.], seq 3517092:3517256, ack 1873, win 501, length 164
09:58:45.536484 IP 159.203.62.249.22 > 99.238.40.163.58902: Flags [P.], seq 3517256:3517420, ack 1873, win 501, length 164
09:58:45.536600 IP 159.203.62.249.22 > 99.238.40.163.58902: Flags [P.], seq 3517420:3517584, ack 1873, win 501, length 164
09:58:45.536710 IP 159.203.62.249.22 > 99.238.40.163.58902: Flags [P.], seq 3517584:3517748, ack 1873, win 501, length 164
09:58:45.536833 IP 159.203.62.249.22 > 99.238.40.163.58902: Flags [P.], seq 3517748:3517912, ack 1873, win 501, length 164
09:58:45.536948 IP 159.203.62.249.22 > 99.238.40.163.58902: Flags [P.], seq 3517912:3518076, ack 1873, win 501, length 164
09:58:45.537108 IP 159.203.62.249.22 > 99.238.40.163.58902: Flags [P.], seq 3518076:3518240, ack 1873, win 501, length 164
09:58:45.537223 IP 159.203.62.249.22 > 99.238.40.163.58902: Flags [P.], seq 3518240:3518404, ack 1873, win 501, length 164
09:58:45.537348 IP 159.203.62.249.22 > 99.238.40.163.58902: Flags [P.], seq 3518404:3518568, ack 1873, win 501, length 164
09:58:45.537480 IP 159.203.62.249.22 > 99.238.40.163.58902: Flags [P.], seq 3518568:3518732, ack 1873, win 501, length 164
09:58:45.537794 IP 159.203.62.249.22 > 99.238.40.163.58902: Flags [P.], seq 3518732:3518896, ack 1873, win 501, length 164
09:58:45.537936 IP 159.203.62.249.22 > 99.238.40.163.58902: Flags [P.], seq 3518896:3519060, ack 1873, win 501, length 164
09:58:45.538058 IP 159.203.62.249.22 > 99.238.40.163.58902: Flags [P.], seq 3519060:3519224, ack 1873, win 501, length 164
09:58:45.538174 IP 159.203.62.249.22 > 99.238.40.163.58902: Flags [P.], seq 3519224:3519388, ack 1873, win 501, length 164
09:58:45.538297 IP 159.203.62.249.22 > 99.238.40.163.58902: Flags [P.], seq 3519388:3519552, ack 1873, win 501, length 164
09:58:45.538431 IP 159.203.62.249.22 > 99.238.40.163.58902: Flags [P.], seq 3519552:3519716, ack 1873, win 501, length 164
09:58:45.538560 IP 159.203.62.249.22 > 99.238.40.163.58902: Flags [P.], seq 3519716:3519880, ack 1873, win 501, length 164
09:58:45.538682 IP 159.203.62.249.22 > 99.238.40.163.58902: Flags [P.], seq 3519880:3520044, ack 1873, win 501, length 164
09:58:45.538807 IP 159.203.62.249.22 > 99.238.40.163.58902: Flags [P.], seq 3520044:3520208, ack 1873, win 501, length 164
09:58:45.538924 IP 159.203.62.249.22 > 99.238.40.163.58902: Flags [P.], seq 3520208:3520372, ack 1873, win 501, length 164
09:58:45.539035 IP 159.203.62.249.22 > 99.238.40.163.58902: Flags [P.], seq 3520372:3520536, ack 1873, win 501, length 164
09:58:45.539120 IP 99.238.40.163.58902 > 159.203.62.249.22: Flags [.], ack 3497064, win 1022, length 0
09:58:45.539120 IP 99.238.40.163.58902 > 159.203.62.249.22: Flags [.], ack 3498540, win 1023, length 0
09:58:45.539293 IP 159.203.62.249.22 > 99.238.40.163.58902: Flags [P.], seq 3520536:3520908, ack 1873, win 501, length 372
09:58:45.539430 IP 159.203.62.249.22 > 99.238.40.163.58902: Flags [P.], seq 3520908:3521072, ack 1873, win 501, length 164
09:58:45.539544 IP 159.203.62.249.22 > 99.238.40.163.58902: Flags [P.], seq 3521072:3521236, ack 1873, win 501, length 164
09:58:45.539654 IP 159.203.62.249.22 > 99.238.40.163.58902: Flags [P.], seq 3521236:3521400, ack 1873, win 501, length 164
09:58:45.539808 IP 159.203.62.249.22 > 99.238.40.163.58902: Flags [P.], seq 3521400:3521564, ack 1873, win 501, length 164
09:58:45.539928 IP 159.203.62.249.22 > 99.238.40.163.58902: Flags [P.], seq 3521564:3521728, ack 1873, win 501, length 164
09:58:45.540049 IP 159.203.62.249.22 > 99.238.40.163.58902: Flags [P.], seq 3521728:3521892, ack 1873, win 501, length 164
09:58:45.540158 IP 159.203.62.249.22 > 99.238.40.163.58902: Flags [P.], seq 3521892:3522056, ack 1873, win 501, length 164
09:58:45.540529 IP 159.203.62.249.22 > 99.238.40.163.58902: Flags [P.], seq 3522056:3522220, ack 1873, win 501, length 164
09:58:45.540659 IP 159.203.62.249.22 > 99.238.40.163.58902: Flags [P.], seq 3522220:3522384, ack 1873, win 501, length 164
09:58:45.540787 IP 159.203.62.249.22 > 99.238.40.163.58902: Flags [P.], seq 3522384:3522548, ack 1873, win 501, length 164
09:58:45.540918 IP 159.203.62.249.22 > 99.238.40.163.58902: Flags [P.], seq 3522548:3522712, ack 1873, win 501, length 164
09:58:45.541029 IP 159.203.62.249.22 > 99.238.40.163.58902: Flags [P.], seq 3522712:3522876, ack 1873, win 501, length 164
09:58:45.541141 IP 159.203.62.249.22 > 99.238.40.163.58902: Flags [P.], seq 3522876:3523040, ack 1873, win 501, length 164
09:58:45.541246 IP 159.203.62.249.22 > 99.238.40.163.58902: Flags [P.], seq 3523040:3523204, ack 1873, win 501, length 164
09:58:45.541501 IP 159.203.62.249.22 > 99.238.40.163.58902: Flags [P.], seq 3523204:3523368, ack 1873, win 501, length 164
09:58:45.541629 IP 159.203.62.249.22 > 99.238.40.163.58902: Flags [P.], seq 3523368:3523532, ack 1873, win 501, length 164
09:58:45.541741 IP 159.203.62.249.22 > 99.238.40.163.58902: Flags [P.], seq 3523532:3523696, ack 1873, win 501, length 164
09:58:45.541884 IP 159.203.62.249.22 > 99.238.40.163.58902: Flags [P.], seq 3523696:3523860, ack 1873, win 501, length 164
09:58:45.541999 IP 159.203.62.249.22 > 99.238.40.163.58902: Flags [P.], seq 3523860:3524024, ack 1873, win 501, length 164
09:58:45.542116 IP 159.203.62.249.22 > 99.238.40.163.58902: Flags [P.], seq 3524024:3524188, ack 1873, win 501, length 164
09:58:45.542233 IP 159.203.62.249.22 > 99.238.40.163.58902: Flags [P.], seq 3524188:3524352, ack 1873, win 501, length 164
09:58:45.542363 IP 159.203.62.249.22 > 99.238.40.163.58902: Flags [P.], seq 3524352:3524516, ack 1873, win 501, length 164
09:58:45.542481 IP 159.203.62.249.22 > 99.238.40.163.58902: Flags [P.], seq 3524516:3524680, ack 1873, win 501, length 164
09:58:45.542627 IP 159.203.62.249.22 > 99.238.40.163.58902: Flags [P.], seq 3524680:3524844, ack 1873, win 501, length 164
09:58:45.542794 IP 159.203.62.249.22 > 99.238.40.163.58902: Flags [P.], seq 3524844:3525008, ack 1873, win 501, length 164
09:58:45.543044 IP 159.203.62.249.22 > 99.238.40.163.58902: Flags [P.], seq 3525008:3525172, ack 1873, win 501, length 164
09:58:45.543175 IP 159.203.62.249.22 > 99.238.40.163.58902: Flags [P.], seq 3525172:3525336, ack 1873, win 501, length 164
09:58:45.543296 IP 159.203.62.249.22 > 99.238.40.163.58902: Flags [P.], seq 3525336:3525500, ack 1873, win 501, length 164
09:58:45.543404 IP 159.203.62.249.22 > 99.238.40.163.58902: Flags [P.], seq 3525500:3525664, ack 1873, win 501, length 164
09:58:45.543535 IP 159.203.62.249.22 > 99.238.40.163.58902: Flags [P.], seq 3525664:3525828, ack 1873, win 501, length 164
09:58:45.543652 IP 159.203.62.249.22 > 99.238.40.163.58902: Flags [P.], seq 3525828:3525992, ack 1873, win 501, length 164
09:58:45.543769 IP 159.203.62.249.22 > 99.238.40.163.58902: Flags [P.], seq 3525992:3526156, ack 1873, win 501, length 164
09:58:45.543895 IP 159.203.62.249.22 > 99.238.40.163.58902: Flags [P.], seq 3526156:3526320, ack 1873, win 501, length 164
09:58:45.544026 IP 159.203.62.249.22 > 99.238.40.163.58902: Flags [P.], seq 3526320:3526484, ack 1873, win 501, length 164
09:58:45.544150 IP 159.203.62.249.22 > 99.238.40.163.58902: Flags [P.], seq 3526484:3526648, ack 1873, win 501, length 164
09:58:45.544264 IP 159.203.62.249.22 > 99.238.40.163.58902: Flags [P.], seq 3526648:3526812, ack 1873, win 501, length 164
09:58:45.544398 IP 159.203.62.249.22 > 99.238.40.163.58902: Flags [P.], seq 3526812:3526976, ack 1873, win 501, length 164
09:58:45.544513 IP 159.203.62.249.22 > 99.238.40.163.58902: Flags [P.], seq 3526976:3527140, ack 1873, win 501, length 164
09:58:45.544642 IP 159.203.62.249.22 > 99.238.40.163.58902: Flags [P.], seq 3527140:3527304, ack 1873, win 501, length 164
09:58:45.544764 IP 159.203.62.249.22 > 99.238.40.163.58902: Flags [P.], seq 3527304:3527468, ack 1873, win 501, length 164
09:58:45.544879 IP 159.203.62.249.22 > 99.238.40.163.58902: Flags [P.], seq 3527468:3527632, ack 1873, win 501, length 164
09:58:45.544997 IP 159.203.62.249.22 > 99.238.40.163.58902: Flags [P.], seq 3527632:3527796, ack 1873, win 501, length 164
09:58:45.545112 IP 99.238.40.163.58902 > 159.203.62.249.22: Flags [.], ack 3506188, win 1024, length 0
09:58:45.545113 IP 99.238.40.163.58902 > 159.203.62.249.22: Flags [.], ack 3507008, win 1026, length 0
09:58:45.545222 IP 99.238.40.163.58902 > 159.203.62.249.22: Flags [.], ack 3511724, win 1022, length 0
09:58:45.545222 IP 99.238.40.163.58902 > 159.203.62.249.22: Flags [.], ack 3513320, win 1024, length 0
09:58:45.545222 IP 99.238.40.163.58902 > 159.203.62.249.22: Flags [.], ack 3514960, win 1023, length 0
09:58:45.545501 IP 159.203.62.249.22 > 99.238.40.163.58902: Flags [P.], seq 3527796:3527960, ack 1873, win 501, length 164
09:58:45.545624 IP 159.203.62.249.22 > 99.238.40.163.58902: Flags [P.], seq 3527960:3528644, ack 1873, win 501, length 684
09:58:45.545747 IP 159.203.62.249.22 > 99.238.40.163.58902: Flags [P.], seq 3528644:3528808, ack 1873, win 501, length 164
09:58:45.545888 IP 159.203.62.249.22 > 99.238.40.163.58902: Flags [P.], seq 3528808:3528972, ack 1873, win 501, length 164
09:58:45.546008 IP 159.203.62.249.22 > 99.238.40.163.58902: Flags [P.], seq 3528972:3529136, ack 1873, win 501, length 164
09:58:45.546116 IP 159.203.62.249.22 > 99.238.40.163.58902: Flags [P.], seq 3529136:3529300, ack 1873, win 501, length 164
09:58:45.546242 IP 159.203.62.249.22 > 99.238.40.163.58902: Flags [P.], seq 3529300:3529464, ack 1873, win 501, length 164
09:58:45.546357 IP 159.203.62.249.22 > 99.238.40.163.58902: Flags [P.], seq 3529464:3529628, ack 1873, win 501, length 164
09:58:45.546476 IP 159.203.62.249.22 > 99.238.40.163.58902: Flags [P.], seq 3529628:3529792, ack 1873, win 501, length 164
09:58:45.546618 IP 159.203.62.249.22 > 99.238.40.163.58902: Flags [P.], seq 3529792:3529956, ack 1873, win 501, length 164
09:58:45.546730 IP 159.203.62.249.22 > 99.238.40.163.58902: Flags [P.], seq 3529956:3530120, ack 1873, win 501, length 164
09:58:45.546848 IP 159.203.62.249.22 > 99.238.40.163.58902: Flags [P.], seq 3530120:3530284, ack 1873, win 501, length 164
09:58:45.546957 IP 159.203.62.249.22 > 99.238.40.163.58902: Flags [P.], seq 3530284:3530448, ack 1873, win 501, length 164
09:58:45.547083 IP 159.203.62.249.22 > 99.238.40.163.58902: Flags [P.], seq 3530448:3530612, ack 1873, win 501, length 164
09:58:45.547195 IP 159.203.62.249.22 > 99.238.40.163.58902: Flags [P.], seq 3530612:3530776, ack 1873, win 501, length 164
09:58:45.547304 IP 159.203.62.249.22 > 99.238.40.163.58902: Flags [P.], seq 3530776:3530940, ack 1873, win 501, length 164
09:58:45.547430 IP 159.203.62.249.22 > 99.238.40.163.58902: Flags [P.], seq 3530940:3531104, ack 1873, win 501, length 164
09:58:45.547557 IP 159.203.62.249.22 > 99.238.40.163.58902: Flags [P.], seq 3531104:3531268, ack 1873, win 501, length 164
09:58:45.547677 IP 159.203.62.249.22 > 99.238.40.163.58902: Flags [P.], seq 3531268:3531432, ack 1873, win 501, length 164
09:58:45.547793 IP 159.203.62.249.22 > 99.238.40.163.58902: Flags [P.], seq 3531432:3531596, ack 1873, win 501, length 164
09:58:45.547917 IP 159.203.62.249.22 > 99.238.40.163.58902: Flags [P.], seq 3531596:3531760, ack 1873, win 501, length 164
09:58:45.548040 IP 159.203.62.249.22 > 99.238.40.163.58902: Flags [P.], seq 3531760:3531924, ack 1873, win 501, length 164
09:58:45.548181 IP 159.203.62.249.22 > 99.238.40.163.58902: Flags [P.], seq 3531924:3532088, ack 1873, win 501, length 164
09:58:45.548294 IP 159.203.62.249.22 > 99.238.40.163.58902: Flags [P.], seq 3532088:3532252, ack 1873, win 501, length 164
09:58:45.548421 IP 159.203.62.249.22 > 99.238.40.163.58902: Flags [P.], seq 3532252:3532416, ack 1873, win 501, length 164
09:58:45.548541 IP 159.203.62.249.22 > 99.238.40.163.58902: Flags [P.], seq 3532416:3532580, ack 1873, win 501, length 164
09:58:45.548661 IP 159.203.62.249.22 > 99.238.40.163.58902: Flags [P.], seq 3532580:3532744, ack 1873, win 501, length 164
09:58:45.548777 IP 159.203.62.249.22 > 99.238.40.163.58902: Flags [P.], seq 3532744:3532908, ack 1873, win 501, length 164
09:58:45.548892 IP 159.203.62.249.22 > 99.238.40.163.58902: Flags [P.], seq 3532908:3533072, ack 1873, win 501, length 164
09:58:45.549011 IP 159.203.62.249.22 > 99.238.40.163.58902: Flags [P.], seq 3533072:3533236, ack 1873, win 501, length 164
09:58:45.549134 IP 159.203.62.249.22 > 99.238.40.163.58902: Flags [P.], seq 3533236:3533400, ack 1873, win 501, length 164
09:58:45.549247 IP 159.203.62.249.22 > 99.238.40.163.58902: Flags [P.], seq 3533400:3533564, ack 1873, win 501, length 164
09:58:45.549356 IP 159.203.62.249.22 > 99.238.40.163.58902: Flags [P.], seq 3533564:3533728, ack 1873, win 501, length 164
09:58:45.549466 IP 159.203.62.249.22 > 99.238.40.163.58902: Flags [P.], seq 3533728:3533892, ack 1873, win 501, length 164
09:58:45.549593 IP 159.203.62.249.22 > 99.238.40.163.58902: Flags [P.], seq 3533892:3534056, ack 1873, win 501, length 164
09:58:45.549715 IP 159.203.62.249.22 > 99.238.40.163.58902: Flags [P.], seq 3534056:3534220, ack 1873, win 501, length 164
09:58:45.549858 IP 159.203.62.249.22 > 99.238.40.163.58902: Flags [P.], seq 3534220:3534384, ack 1873, win 501, length 164
09:58:45.549976 IP 159.203.62.249.22 > 99.238.40.163.58902: Flags [P.], seq 3534384:3534548, ack 1873, win 501, length 164
09:58:45.550095 IP 159.203.62.249.22 > 99.238.40.163.58902: Flags [P.], seq 3534548:3534712, ack 1873, win 501, length 164
09:58:45.550213 IP 159.203.62.249.22 > 99.238.40.163.58902: Flags [P.], seq 3534712:3534876, ack 1873, win 501, length 164
09:58:45.550335 IP 159.203.62.249.22 > 99.238.40.163.58902: Flags [P.], seq 3534876:3535040, ack 1873, win 501, length 164
09:58:45.550445 IP 159.203.62.249.22 > 99.238.40.163.58902: Flags [P.], seq 3535040:3535204, ack 1873, win 501, length 164
09:58:45.550579 IP 159.203.62.249.22 > 99.238.40.163.58902: Flags [P.], seq 3535204:3535368, ack 1873, win 501, length 164
09:58:45.550697 IP 159.203.62.249.22 > 99.238.40.163.58902: Flags [P.], seq 3535368:3535532, ack 1873, win 501, length 164
09:58:45.550804 IP 159.203.62.249.22 > 99.238.40.163.58902: Flags [P.], seq 3535532:3535696, ack 1873, win 501, length 164
09:58:45.550932 IP 159.203.62.249.22 > 99.238.40.163.58902: Flags [P.], seq 3535696:3535860, ack 1873, win 501, length 164
09:58:45.551042 IP 159.203.62.249.22 > 99.238.40.163.58902: Flags [P.], seq 3535860:3536024, ack 1873, win 501, length 164
09:58:45.551143 IP 159.203.62.249.22 > 99.238.40.163.58902: Flags [P.], seq 3536024:3536188, ack 1873, win 501, length 164
09:58:45.551255 IP 159.203.62.249.22 > 99.238.40.163.58902: Flags [P.], seq 3536188:3536352, ack 1873, win 501, length 164
09:58:45.551372 IP 159.203.62.249.22 > 99.238.40.163.58902: Flags [P.], seq 3536352:3536516, ack 1873, win 501, length 164
09:58:45.551490 IP 159.203.62.249.22 > 99.238.40.163.58902: Flags [P.], seq 3536516:3536680, ack 1873, win 501, length 164
09:58:45.551607 IP 159.203.62.249.22 > 99.238.40.163.58902: Flags [P.], seq 3536680:3536844, ack 1873, win 501, length 164
09:58:45.551720 IP 159.203.62.249.22 > 99.238.40.163.58902: Flags [P.], seq 3536844:3537008, ack 1873, win 501, length 164
09:58:45.551844 IP 159.203.62.249.22 > 99.238.40.163.58902: Flags [P.], seq 3537008:3537172, ack 1873, win 501, length 164
09:58:45.551959 IP 159.203.62.249.22 > 99.238.40.163.58902: Flags [P.], seq 3537172:3537336, ack 1873, win 501, length 164
09:58:45.552075 IP 159.203.62.249.22 > 99.238.40.163.58902: Flags [P.], seq 3537336:3537500, ack 1873, win 501, length 164
09:58:45.552129 IP 99.238.40.163.58902 > 159.203.62.249.22: Flags [.], ack 3517748, win 1026, length 0
09:58:45.552129 IP 99.238.40.163.58902 > 159.203.62.249.22: Flags [.], ack 3519224, win 1026, length 0
09:58:45.552129 IP 99.238.40.163.58902 > 159.203.62.249.22: Flags [.], ack 3521072, win 1026, length 0
09:58:45.552129 IP 99.238.40.163.58902 > 159.203.62.249.22: Flags [.], ack 3521892, win 1023, length 0
09:58:45.552365 IP 159.203.62.249.22 > 99.238.40.163.58902: Flags [P.], seq 3537500:3538080, ack 1873, win 501, length 580
09:58:45.552485 IP 159.203.62.249.22 > 99.238.40.163.58902: Flags [P.], seq 3538080:3538244, ack 1873, win 501, length 164
09:58:45.552617 IP 159.203.62.249.22 > 99.238.40.163.58902: Flags [P.], seq 3538244:3538408, ack 1873, win 501, length 164
09:58:45.552741 IP 159.203.62.249.22 > 99.238.40.163.58902: Flags [P.], seq 3538408:3538572, ack 1873, win 501, length 164
09:58:45.552870 IP 159.203.62.249.22 > 99.238.40.163.58902: Flags [P.], seq 3538572:3538736, ack 1873, win 501, length 164
09:58:45.552989 IP 159.203.62.249.22 > 99.238.40.163.58902: Flags [P.], seq 3538736:3538900, ack 1873, win 501, length 164
09:58:45.553109 IP 159.203.62.249.22 > 99.238.40.163.58902: Flags [P.], seq 3538900:3539064, ack 1873, win 501, length 164
09:58:45.553234 IP 159.203.62.249.22 > 99.238.40.163.58902: Flags [P.], seq 3539064:3539228, ack 1873, win 501, length 164
09:58:45.553334 IP 159.203.62.249.22 > 99.238.40.163.58902: Flags [P.], seq 3539228:3539392, ack 1873, win 501, length 164
09:58:45.553442 IP 159.203.62.249.22 > 99.238.40.163.58902: Flags [P.], seq 3539392:3539556, ack 1873, win 501, length 164
09:58:45.553559 IP 159.203.62.249.22 > 99.238.40.163.58902: Flags [P.], seq 3539556:3539720, ack 1873, win 501, length 164
09:58:45.553677 IP 159.203.62.249.22 > 99.238.40.163.58902: Flags [P.], seq 3539720:3539884, ack 1873, win 501, length 164
09:58:45.553822 IP 159.203.62.249.22 > 99.238.40.163.58902: Flags [P.], seq 3539884:3540048, ack 1873, win 501, length 164
09:58:45.553930 IP 159.203.62.249.22 > 99.238.40.163.58902: Flags [P.], seq 3540048:3540212, ack 1873, win 501, length 164
09:58:45.554048 IP 159.203.62.249.22 > 99.238.40.163.58902: Flags [P.], seq 3540212:3540376, ack 1873, win 501, length 164
09:58:45.554165 IP 159.203.62.249.22 > 99.238.40.163.58902: Flags [P.], seq 3540376:3540540, ack 1873, win 501, length 164
09:58:45.554297 IP 159.203.62.249.22 > 99.238.40.163.58902: Flags [P.], seq 3540540:3540704, ack 1873, win 501, length 164
09:58:45.554411 IP 159.203.62.249.22 > 99.238.40.163.58902: Flags [P.], seq 3540704:3540868, ack 1873, win 501, length 164
09:58:45.554554 IP 159.203.62.249.22 > 99.238.40.163.58902: Flags [P.], seq 3540868:3541032, ack 1873, win 501, length 164
09:58:45.554677 IP 159.203.62.249.22 > 99.238.40.163.58902: Flags [P.], seq 3541032:3541196, ack 1873, win 501, length 164
09:58:45.554796 IP 159.203.62.249.22 > 99.238.40.163.58902: Flags [P.], seq 3541196:3541360, ack 1873, win 501, length 164
09:58:45.554909 IP 159.203.62.249.22 > 99.238.40.163.58902: Flags [P.], seq 3541360:3541524, ack 1873, win 501, length 164
09:58:45.555022 IP 159.203.62.249.22 > 99.238.40.163.58902: Flags [P.], seq 3541524:3541688, ack 1873, win 501, length 164
09:58:45.555131 IP 159.203.62.249.22 > 99.238.40.163.58902: Flags [P.], seq 3541688:3541852, ack 1873, win 501, length 164
09:58:45.555248 IP 159.203.62.249.22 > 99.238.40.163.58902: Flags [P.], seq 3541852:3542016, ack 1873, win 501, length 164
09:58:45.555434 IP 159.203.62.249.22 > 99.238.40.163.58902: Flags [P.], seq 3542016:3542180, ack 1873, win 501, length 164
09:58:45.555553 IP 159.203.62.249.22 > 99.238.40.163.58902: Flags [P.], seq 3542180:3542344, ack 1873, win 501, length 164
09:58:45.555681 IP 159.203.62.249.22 > 99.238.40.163.58902: Flags [P.], seq 3542344:3542508, ack 1873, win 501, length 164
09:58:45.555796 IP 159.203.62.249.22 > 99.238.40.163.58902: Flags [P.], seq 3542508:3542672, ack 1873, win 501, length 164
09:58:45.555930 IP 159.203.62.249.22 > 99.238.40.163.58902: Flags [P.], seq 3542672:3542836, ack 1873, win 501, length 164
09:58:45.556040 IP 159.203.62.249.22 > 99.238.40.163.58902: Flags [P.], seq 3542836:3543000, ack 1873, win 501, length 164
09:58:45.556169 IP 159.203.62.249.22 > 99.238.40.163.58902: Flags [P.], seq 3543000:3543164, ack 1873, win 501, length 164
09:58:45.556287 IP 159.203.62.249.22 > 99.238.40.163.58902: Flags [P.], seq 3543164:3543328, ack 1873, win 501, length 164
09:58:45.556412 IP 159.203.62.249.22 > 99.238.40.163.58902: Flags [P.], seq 3543328:3543492, ack 1873, win 501, length 164
09:58:45.556536 IP 159.203.62.249.22 > 99.238.40.163.58902: Flags [P.], seq 3543492:3543656, ack 1873, win 501, length 164
09:58:45.556651 IP 159.203.62.249.22 > 99.238.40.163.58902: Flags [P.], seq 3543656:3543820, ack 1873, win 501, length 164
09:58:45.556777 IP 159.203.62.249.22 > 99.238.40.163.58902: Flags [P.], seq 3543820:3543984, ack 1873, win 501, length 164
09:58:45.556900 IP 159.203.62.249.22 > 99.238.40.163.58902: Flags [P.], seq 3543984:3544148, ack 1873, win 501, length 164
09:58:45.557015 IP 159.203.62.249.22 > 99.238.40.163.58902: Flags [P.], seq 3544148:3544312, ack 1873, win 501, length 164
09:58:45.557127 IP 159.203.62.249.22 > 99.238.40.163.58902: Flags [P.], seq 3544312:3544476, ack 1873, win 501, length 164
09:58:45.557260 IP 159.203.62.249.22 > 99.238.40.163.58902: Flags [P.], seq 3544476:3544640, ack 1873, win 501, length 164
09:58:45.557371 IP 159.203.62.249.22 > 99.238.40.163.58902: Flags [P.], seq 3544640:3544804, ack 1873, win 501, length 164
09:58:45.557492 IP 159.203.62.249.22 > 99.238.40.163.58902: Flags [P.], seq 3544804:3544968, ack 1873, win 501, length 164
09:58:45.557609 IP 159.203.62.249.22 > 99.238.40.163.58902: Flags [P.], seq 3544968:3545132, ack 1873, win 501, length 164
09:58:45.557728 IP 159.203.62.249.22 > 99.238.40.163.58902: Flags [P.], seq 3545132:3545296, ack 1873, win 501, length 164
09:58:45.557869 IP 159.203.62.249.22 > 99.238.40.163.58902: Flags [P.], seq 3545296:3545460, ack 1873, win 501, length 164
09:58:45.557994 IP 159.203.62.249.22 > 99.238.40.163.58902: Flags [P.], seq 3545460:3545624, ack 1873, win 501, length 164
09:58:45.558112 IP 159.203.62.249.22 > 99.238.40.163.58902: Flags [P.], seq 3545624:3545788, ack 1873, win 501, length 164
09:58:45.558230 IP 159.203.62.249.22 > 99.238.40.163.58902: Flags [P.], seq 3545788:3545952, ack 1873, win 501, length 164
09:58:45.558334 IP 159.203.62.249.22 > 99.238.40.163.58902: Flags [P.], seq 3545952:3546116, ack 1873, win 501, length 164
09:58:45.558447 IP 159.203.62.249.22 > 99.238.40.163.58902: Flags [P.], seq 3546116:3546280, ack 1873, win 501, length 164
09:58:45.558585 IP 159.203.62.249.22 > 99.238.40.163.58902: Flags [P.], seq 3546280:3546444, ack 1873, win 501, length 164
09:58:45.558717 IP 159.203.62.249.22 > 99.238.40.163.58902: Flags [P.], seq 3546444:3546608, ack 1873, win 501, length 164
09:58:45.558844 IP 159.203.62.249.22 > 99.238.40.163.58902: Flags [P.], seq 3546608:3546772, ack 1873, win 501, length 164
09:58:45.558953 IP 159.203.62.249.22 > 99.238.40.163.58902: Flags [P.], seq 3546772:3546936, ack 1873, win 501, length 164
09:58:45.559071 IP 159.203.62.249.22 > 99.238.40.163.58902: Flags [P.], seq 3546936:3547100, ack 1873, win 501, length 164
09:58:45.559170 IP 99.238.40.163.58902 > 159.203.62.249.22: Flags [P.], seq 1873:1909, ack 3521892, win 1023, length 36
09:58:45.559170 IP 99.238.40.163.58902 > 159.203.62.249.22: Flags [.], ack 3527796, win 1026, length 0
